{
  "backgroundColor": "rgb(42, 42, 42)",
  "textColor": "rgb(148, 148, 148)",
  "title": "Electric Avenue",
  "tagline": "Energy must flow",
  "notes": "\nProcess details: \n\nThis is a large SVG built up of several layers, much like how one would do a traditional painting.\n\nThe final SVGs are usually around 50-150mb in size.\n \nWith each piece I hone the software I'm crafting to produce the images.\n \nThe balance between programming and art I find pleases my soul.\n",
  "property": {
    "artist": "Matthew Joseph Taylor",
    "mediatype": "image/png",
    "year": 2021,
    "style": [
      "Abstract",
      "Expressionist"
    ]
  },
  "hashTag": {
    "IG": [
      "abstractart_daily",
      "abstractdigital",
      "abstractdigitalart",
      "abstractexpressionism",
      "amazingabstracts",
      "archdrawing",
      "artobserved",
      "arttherapy",
      "artview",
      "artwillsaveus",
      "buildingsketch",
      "codeart",
      "contemporaryexpressionism",
      "creativegrammer",
      "dailysketch",
      "deepart",
      "distortionart",
      "fineart",
      "houseportrait",
      "housesketch",
      "illustration",
      "instaart",
      "sketchcollector",
      "thecreatart",
      "theuniversalart",
      "unitedbyedit",
      "urbansketcher",
      "urbansketching",
      "usk",
      "visualfodder"
    ],
    "ArtStation": [
      "abstract",
      "art",
      "artist",
      "artoftheday",
      "dart",
      "digitalart",
      "illustration",
      "painting"
    ],
    "Minds": [
      "artcommunity",
      "artfinder",
      "artist",
      "artistsonminds",
      "myart"
    ],
    "Redbubble": [
      "abstract",
      "artist",
      "expressionist",
      "mjtdev"
    ]
  },
  "action": [
    {
      "callToAction": "View on Instagram",
      "url": "https://www.instagram.com/mjtdev"
    },
    {
      "callToAction": "View on Minds",
      "url": "https://www.minds.com/mjtdev"
    },
    {
      "callToAction": "View on ArtStation",
      "url": "https://mjtdev.artstation.com"
    },
    {
      "callToAction": "Buy on Redbubble",
      "url": "https://www.redbubble.com/people/truepurpose/shop"
    },
    {
      "callToAction": "Own the NFT",
      "url": "https://opensea.io/collection/mjt-dev"
    }
  ],
  "artId": "art-1qkurh6-kpuxj8nr",
  "description": "\"Electric Avenue\"\n\nEnergy must flow\n\n\nProcess details: \n\nThis is a large SVG built up of several layers, much like how one would do a traditional painting.\n\nThe final SVGs are usually around 50-150mb in size.\n \nWith each piece I hone the software I&#x27;m crafting to produce the images.\n \nThe balance between programming and art I find pleases my soul.\n\n\nHigh resolution image on my website\n\nhttps://mjt.dev/art-1qkurh6-kpuxj8nr\n\nLinks to more of my work in my profile\n\nThanks :)\n\n---IG---\n#abstractart_daily #abstractdigital #abstractdigitalart #abstractexpressionism #amazingabstracts #archdrawing #artobserved #arttherapy #artview #artwillsaveus #buildingsketch #codeart #contemporaryexpressionism #creativegrammer #dailysketch #deepart #distortionart #fineart #houseportrait #housesketch #illustration #instaart #sketchcollector #thecreatart #theuniversalart #unitedbyedit #urbansketcher #urbansketching #usk #visualfodder\n\n---ArtStation---\n#abstract #art #artist #artoftheday #dart #digitalart #illustration #painting\n\n---Minds---\n#artcommunity #artfinder #artist #artistsonminds #myart\n\n---Redbubble---\n#abstract #artist #expressionist #mjtdev\n\n"
}