{
  "backgroundColor": "rgb(128, 128, 128)",
  "textColor": "rgb(21, 21, 21)",
  "title": "Punk Soul",
  "tagline": "It is the duty of youth to rebel",
  "property": {
    "artist": "Matthew Joseph Taylor",
    "mediatype": "image/png",
    "year": 2021,
    "style": [
      "Abstract",
      "Expressionist"
    ]
  },
  "hashTag": {
    "IG": [
      "abstractart",
      "abstractart_daily",
      "abstractexpressionism",
      "amazingabstracts",
      "artobserved",
      "artoftheday",
      "arttherapy",
      "artview",
      "codeart",
      "contemporaryart",
      "contemporaryexpressionism",
      "creativegrammer",
      "dailyabstract",
      "dark",
      "darkart",
      "darksurrealism",
      "digitalpainters",
      "face",
      "figurativeartists",
      "figurepainting",
      "head",
      "modernabstract",
      "newaesthetic",
      "newmediaart",
      "nft",
      "punk",
      "techspressionism",
      "thecreatart",
      "theuniversalart",
      "unitedbyedit"
    ],
    "ArtStation": [
      "abstract",
      "art",
      "artist",
      "artoftheday",
      "dart",
      "digitalart",
      "illustration",
      "painting"
    ],
    "Minds": [
      "artist",
      "artistsonminds",
      "artwork",
      "creativecommunity",
      "digitalart"
    ],
    "Redbubble": [
      "abstract",
      "artist",
      "expressionist",
      "mjtdev"
    ]
  },
  "action": [
    {
      "callToAction": "View on Instagram",
      "url": "https://www.instagram.com/mjtdev"
    },
    {
      "callToAction": "View on Minds",
      "url": "https://www.minds.com/mjtdev"
    },
    {
      "callToAction": "View on ArtStation",
      "url": "https://mjtdev.artstation.com"
    },
    {
      "callToAction": "Buy on Redbubble",
      "url": "https://www.redbubble.com/people/truepurpose/shop"
    },
    {
      "callToAction": "Own the NFT",
      "url": "https://opensea.io/collection/mjt-dev"
    }
  ],
  "artId": "art-19z6q1o-kpj6b8gp",
  "description": "\"Punk Soul\"\n\nIt is the duty of youth to rebel\n\n\n\nHigh resolution image on my website\n\nhttps://mjt.dev/art-19z6q1o-kpj6b8gp\n\nLinks to more of my work in my profile\n\nThanks :)\n\n---IG---\n#abstractart #abstractart_daily #abstractexpressionism #amazingabstracts #artobserved #artoftheday #arttherapy #artview #codeart #contemporaryart #contemporaryexpressionism #creativegrammer #dailyabstract #dark #darkart #darksurrealism #digitalpainters #face #figurativeartists #figurepainting #head #modernabstract #newaesthetic #newmediaart #nft #punk #techspressionism #thecreatart #theuniversalart #unitedbyedit\n\n---ArtStation---\n#abstract #art #artist #artoftheday #dart #digitalart #illustration #painting\n\n---Minds---\n#artist #artistsonminds #artwork #creativecommunity #digitalart\n\n---Redbubble---\n#abstract #artist #expressionist #mjtdev\n\n"
}