{
  "backgroundColor": "rgb(234, 234, 234)",
  "textColor": "rgb(96, 96, 96)",
  "title": "Temples in Praise of Civilization",
  "tagline": "We build the city, and the city builds us.",
  "property": {
    "artist": "Matthew Joseph Taylor",
    "mediatype": "image/png",
    "year": 2021,
    "style": [
      "Abstract",
      "Expressionist"
    ]
  },
  "hashTag": {
    "IG": [
      "abstractart",
      "abstractartorg",
      "abstractdigital",
      "abstractdigitalart",
      "abstractexpressionism",
      "artobserved",
      "artoftheday",
      "artview",
      "canada",
      "city",
      "cntower",
      "codeart",
      "contemporaryart",
      "dailypainting",
      "deepart",
      "digitalart",
      "digitalpainters",
      "distortionart",
      "mafia_editlove",
      "newaesthetic",
      "nft",
      "redbubbleartists",
      "skyscraper",
      "techspressionism",
      "thecreatart",
      "theuniversalart",
      "toronto",
      "tower",
      "unitedbyedit",
      "visualfodder"
    ],
    "ArtStation": [
      "abstract",
      "art",
      "artist",
      "artoftheday",
      "dart",
      "digitalart",
      "illustration",
      "painting"
    ],
    "Minds": [
      "artcommunity",
      "artfinderapril",
      "artist",
      "artistsonminds",
      "creativecommunity"
    ],
    "Redbubble": [
      "abstract",
      "artist",
      "expressionist",
      "mjtdev"
    ]
  },
  "action": [
    {
      "callToAction": "View on Instagram",
      "url": "https://www.instagram.com/mjtdev"
    },
    {
      "callToAction": "View on Minds",
      "url": "https://www.minds.com/mjtdev"
    },
    {
      "callToAction": "View on ArtStation",
      "url": "https://mjtdev.artstation.com"
    },
    {
      "callToAction": "Buy on Redbubble",
      "url": "https://www.redbubble.com/people/truepurpose/shop"
    },
    {
      "callToAction": "Own the NFT",
      "url": "https://opensea.io/collection/mjt-dev"
    }
  ],
  "artId": "art-13936j0-knuvrjc9",
  "description": "\"Temples in Praise of Civilization\"\nWe build the city, and the city builds us.\n\nHigh resolution image, owning, etc...\n\nhttps://mjt.dev/art-13936j0-knuvrjc9\n\nLink in profile.\n\nThanks :)\n\n---IG---\n#abstractart #abstractartorg #abstractdigital #abstractdigitalart #abstractexpressionism #artobserved #artoftheday #artview #canada #city #cntower #codeart #contemporaryart #dailypainting #deepart #digitalart #digitalpainters #distortionart #mafia_editlove #newaesthetic #nft #redbubbleartists #skyscraper #techspressionism #thecreatart #theuniversalart #toronto #tower #unitedbyedit #visualfodder\n\n---ArtStation---\n#abstract #art #artist #artoftheday #dart #digitalart #illustration #painting\n\n---Minds---\n#artcommunity #artfinderapril #artist #artistsonminds #creativecommunity\n\n---Redbubble---\n#abstract #artist #expressionist #mjtdev\n\n"
}