{
  "backgroundColor": "rgb(128, 128, 128)",
  "textColor": "rgb(21, 21, 21)",
  "title": "Searching For Guidance",
  "tagline": "We all follow something",
  "property": {
    "artist": "Matthew Joseph Taylor",
    "mediatype": "image/png",
    "year": 2021,
    "style": [
      "Abstract",
      "Expressionist"
    ]
  },
  "hashTag": {
    "IG": [
      "abstractart",
      "abstractart_daily",
      "abstractdigital",
      "abstractdigitalart",
      "amazingabstracts",
      "artobserved",
      "artoftheday",
      "arttherapy",
      "artview",
      "artwillsaveus",
      "contemporaryart",
      "contemporaryexpressionism",
      "creativegrammer",
      "dailyabstract",
      "darkart",
      "darkartwork",
      "darksurrealism",
      "deepart",
      "digitalart",
      "digitalpainters",
      "distortionart",
      "figurativeabstract",
      "figurativeartist",
      "figurepainting",
      "fineart",
      "generativeart",
      "modernabstract",
      "newaesthetic",
      "techspressionism",
      "theuniversalart"
    ],
    "ArtStation": [
      "abstract",
      "art",
      "artist",
      "artoftheday",
      "dart",
      "digitalart",
      "illustration",
      "painting"
    ],
    "Minds": [
      "art",
      "artcommunity",
      "artfinder",
      "artist",
      "artistsonminds"
    ],
    "Redbubble": [
      "abstract",
      "artist",
      "expressionist",
      "mjtdev"
    ]
  },
  "action": [
    {
      "callToAction": "View on Instagram",
      "url": "https://www.instagram.com/mjtdev"
    },
    {
      "callToAction": "View on Minds",
      "url": "https://www.minds.com/mjtdev"
    },
    {
      "callToAction": "View on ArtStation",
      "url": "https://mjtdev.artstation.com"
    },
    {
      "callToAction": "Buy on Redbubble",
      "url": "https://www.redbubble.com/people/truepurpose/shop"
    },
    {
      "callToAction": "Own the NFT",
      "url": "https://opensea.io/collection/mjt-dev"
    }
  ],
  "artId": "art-kutd7-kpefs1es",
  "description": "\"Searching For Guidance\"\n\nWe all follow something\n\n\n\nHigh resolution image on my website\n\nhttps://mjt.dev/art-kutd7-kpefs1es\n\nLinks to more of my work in my profile\n\nThanks :)\n\n---IG---\n#abstractart #abstractart_daily #abstractdigital #abstractdigitalart #amazingabstracts #artobserved #artoftheday #arttherapy #artview #artwillsaveus #contemporaryart #contemporaryexpressionism #creativegrammer #dailyabstract #darkart #darkartwork #darksurrealism #deepart #digitalart #digitalpainters #distortionart #figurativeabstract #figurativeartist #figurepainting #fineart #generativeart #modernabstract #newaesthetic #techspressionism #theuniversalart\n\n---ArtStation---\n#abstract #art #artist #artoftheday #dart #digitalart #illustration #painting\n\n---Minds---\n#art #artcommunity #artfinder #artist #artistsonminds\n\n---Redbubble---\n#abstract #artist #expressionist #mjtdev\n\n"
}