{
  "backgroundColor": "rgb(234, 234, 234)",
  "textColor": "rgb(96, 96, 96)",
  "title": "Urbanity",
  "tagline": "Our space",
  "property": {
    "artist": "Matthew Joseph Taylor",
    "mediatype": "image/png",
    "year": 2021,
    "style": [
      "Abstract",
      "Expressionist"
    ]
  },
  "hashTag": {
    "IG": [
      "abstractdigitalart",
      "abstractexpressionism",
      "amazingabstracts",
      "archdrawing",
      "artoftheday",
      "arttherapy",
      "artwillsaveus",
      "buildingsketch",
      "citydrawing",
      "codeart",
      "contemporaryart",
      "contemporaryexpressionism",
      "dailysketch",
      "digitalart",
      "digitalpainters",
      "figurepainting",
      "fineart",
      "fineliner",
      "generativeart",
      "houseportrait",
      "housesketch",
      "instaart",
      "modernabstract",
      "newaesthetic",
      "newmediaart",
      "sketchcollector",
      "theuniversalart",
      "unitedbyedit",
      "urban",
      "usk"
    ],
    "ArtStation": [
      "abstract",
      "art",
      "artist",
      "artoftheday",
      "dart",
      "digitalart",
      "illustration",
      "painting"
    ],
    "Minds": [
      "art",
      "artcommunity",
      "artfinder",
      "artist",
      "artistsonminds"
    ],
    "Redbubble": [
      "abstract",
      "artist",
      "expressionist",
      "mjtdev"
    ]
  },
  "action": [
    {
      "callToAction": "View on Instagram",
      "url": "https://www.instagram.com/mjtdev"
    },
    {
      "callToAction": "View on Minds",
      "url": "https://www.minds.com/mjtdev"
    },
    {
      "callToAction": "View on ArtStation",
      "url": "https://mjtdev.artstation.com"
    },
    {
      "callToAction": "Buy on Redbubble",
      "url": "https://www.redbubble.com/people/truepurpose/shop"
    },
    {
      "callToAction": "Own the NFT",
      "url": "https://opensea.io/collection/mjt-dev"
    }
  ],
  "artId": "art-ichhkq-kppmuhfz",
  "description": "\"Urbanity\"\n\nOur space\n\n\n\nHigh resolution image on my website\n\nhttps://mjt.dev/art-ichhkq-kppmuhfz\n\nLinks to more of my work in my profile\n\nThanks :)\n\n---IG---\n#abstractdigitalart #abstractexpressionism #amazingabstracts #archdrawing #artoftheday #arttherapy #artwillsaveus #buildingsketch #citydrawing #codeart #contemporaryart #contemporaryexpressionism #dailysketch #digitalart #digitalpainters #figurepainting #fineart #fineliner #generativeart #houseportrait #housesketch #instaart #modernabstract #newaesthetic #newmediaart #sketchcollector #theuniversalart #unitedbyedit #urban #usk\n\n---ArtStation---\n#abstract #art #artist #artoftheday #dart #digitalart #illustration #painting\n\n---Minds---\n#art #artcommunity #artfinder #artist #artistsonminds\n\n---Redbubble---\n#abstract #artist #expressionist #mjtdev\n\n"
}