{
  "backgroundColor": "rgb(128, 128, 128)",
  "textColor": "rgb(21, 21, 21)",
  "title": "Invitation to Dance",
  "tagline": "Choosing to choose is the most delicious of choices",
  "property": {
    "artist": "Matthew Joseph Taylor",
    "mediatype": "image/png",
    "year": 2021,
    "style": [
      "Abstract",
      "Expressionist"
    ]
  },
  "hashTag": {
    "IG": [
      "abstractart",
      "abstractdigital",
      "abstractdigitalart",
      "allure",
      "alluring",
      "artoftheday",
      "artview",
      "choices",
      "choose",
      "codeart",
      "contemporaryexpressionism",
      "dark",
      "darkart",
      "darkartwork",
      "darksurrealism",
      "deepart",
      "digitalpainters",
      "distortionart",
      "figurativeartist",
      "fineart",
      "invitation",
      "inviting",
      "newaesthetic",
      "newmediaart",
      "nft",
      "techspressionism",
      "thecreatart",
      "theuniversalart",
      "unitedbyedit",
      "visualfodder"
    ],
    "ArtStation": [
      "abstract",
      "art",
      "artist",
      "artoftheday",
      "dart",
      "digitalart",
      "illustration",
      "painting"
    ],
    "Minds": [
      "art",
      "artfinder",
      "artistsonminds",
      "artwork",
      "digitalart"
    ],
    "Redbubble": [
      "abstract",
      "artist",
      "expressionist",
      "mjtdev"
    ]
  },
  "action": [
    {
      "callToAction": "View on Instagram",
      "url": "https://www.instagram.com/mjtdev"
    },
    {
      "callToAction": "View on Minds",
      "url": "https://www.minds.com/mjtdev"
    },
    {
      "callToAction": "View on ArtStation",
      "url": "https://mjtdev.artstation.com"
    },
    {
      "callToAction": "Buy on Redbubble",
      "url": "https://www.redbubble.com/people/truepurpose/shop"
    },
    {
      "callToAction": "Own the NFT",
      "url": "https://opensea.io/collection/mjt-dev"
    }
  ],
  "artId": "art-ljhx5l-kouvzytf",
  "description": "\"Invitation to Dance\"\nChoosing to choose is the most delicious of choices\n\nHigh resolution image, owning, etc...\n\nhttps://mjt.dev/art-ljhx5l-kouvzytf\n\nLink in profile.\n\nThanks :)\n\n---IG---\n#abstractart #abstractdigital #abstractdigitalart #allure #alluring #artoftheday #artview #choices #choose #codeart #contemporaryexpressionism #dark #darkart #darkartwork #darksurrealism #deepart #digitalpainters #distortionart #figurativeartist #fineart #invitation #inviting #newaesthetic #newmediaart #nft #techspressionism #thecreatart #theuniversalart #unitedbyedit #visualfodder\n\n---ArtStation---\n#abstract #art #artist #artoftheday #dart #digitalart #illustration #painting\n\n---Minds---\n#art #artfinder #artistsonminds #artwork #digitalart\n\n---Redbubble---\n#abstract #artist #expressionist #mjtdev\n\n"
}