{
  "backgroundColor": "rgb(128, 128, 128)",
  "textColor": "rgb(21, 21, 21)",
  "title": "Caught in the Moment",
  "tagline": "Now is all that is",
  "property": {
    "artist": "Matthew Joseph Taylor",
    "mediatype": "image/png",
    "year": 2021,
    "style": [
      "Abstract",
      "Expressionist"
    ]
  },
  "hashTag": {
    "IG": [
      "abstractart_daily",
      "abstractexpressionism",
      "amazingabstracts",
      "artobserved",
      "arttherapy",
      "codeart",
      "contemporaryart",
      "contemporaryexpressionism",
      "dailyabstract",
      "dark",
      "darkart",
      "darkartwork",
      "deepart",
      "digitalart",
      "digitalpainters",
      "distortionart",
      "face",
      "figurativeabstract",
      "figurativeartist",
      "figurepainting",
      "fineart",
      "generativeart",
      "head",
      "mastersofdarkart",
      "moment",
      "newmediaart",
      "nft",
      "techspressionism",
      "unitedbyedit",
      "visualfodder"
    ],
    "ArtStation": [
      "abstract",
      "art",
      "artist",
      "artoftheday",
      "dart",
      "digitalart",
      "illustration",
      "painting"
    ],
    "Minds": [
      "art",
      "artcommunity",
      "artfinder",
      "digitalart",
      "myart"
    ],
    "Redbubble": [
      "abstract",
      "artist",
      "expressionist",
      "mjtdev"
    ]
  },
  "action": [
    {
      "callToAction": "View on Instagram",
      "url": "https://www.instagram.com/mjtdev"
    },
    {
      "callToAction": "View on Minds",
      "url": "https://www.minds.com/mjtdev"
    },
    {
      "callToAction": "View on ArtStation",
      "url": "https://mjtdev.artstation.com"
    },
    {
      "callToAction": "Buy on Redbubble",
      "url": "https://www.redbubble.com/people/truepurpose/shop"
    },
    {
      "callToAction": "Own the NFT",
      "url": "https://opensea.io/collection/mjt-dev"
    }
  ],
  "artId": "art-vvkk28-kpk9jwnm",
  "description": "\"Caught in the Moment\"\n\nNow is all that is\n\n\n\nHigh resolution image on my website\n\nhttps://mjt.dev/art-vvkk28-kpk9jwnm\n\nLinks to more of my work in my profile\n\nThanks :)\n\n---IG---\n#abstractart_daily #abstractexpressionism #amazingabstracts #artobserved #arttherapy #codeart #contemporaryart #contemporaryexpressionism #dailyabstract #dark #darkart #darkartwork #deepart #digitalart #digitalpainters #distortionart #face #figurativeabstract #figurativeartist #figurepainting #fineart #generativeart #head #mastersofdarkart #moment #newmediaart #nft #techspressionism #unitedbyedit #visualfodder\n\n---ArtStation---\n#abstract #art #artist #artoftheday #dart #digitalart #illustration #painting\n\n---Minds---\n#art #artcommunity #artfinder #digitalart #myart\n\n---Redbubble---\n#abstract #artist #expressionist #mjtdev\n\n"
}