{
  "backgroundColor": "rgb(128, 128, 128)",
  "textColor": "rgb(21, 21, 21)",
  "title": "Delicate Care",
  "tagline": "The comfort found in being comforted",
  "property": {
    "artist": "Matthew Joseph Taylor",
    "mediatype": "image/png",
    "year": 2021,
    "style": [
      "Abstract",
      "Expressionist"
    ]
  },
  "hashTag": {
    "IG": [
      "abstractdigital",
      "artcollection",
      "artcontemporain",
      "artdesign",
      "artinstadaily",
      "artoftheday",
      "arttherapy",
      "artview",
      "careful",
      "contemporaryart",
      "creativegrammer",
      "creativityeveryday",
      "dailyabstract",
      "dark",
      "decorativeart",
      "decorativearts",
      "delicate",
      "digitalart",
      "digitalpainters",
      "distortionart",
      "expressiveart",
      "figurepainting",
      "fineart",
      "instaartoftheday",
      "interiordesigner",
      "newaesthetic",
      "paintingoftheday",
      "soft",
      "techspressionism",
      "unitedbyedit"
    ],
    "ArtStation": [
      "abstract",
      "art",
      "artist",
      "artoftheday",
      "dart",
      "digitalart",
      "illustration",
      "painting"
    ],
    "Minds": [
      "art",
      "artcommunity",
      "artfinderapril",
      "creativecommunity",
      "myart"
    ],
    "Redbubble": [
      "abstract",
      "artist",
      "expressionist",
      "mjtdev"
    ]
  },
  "action": [
    {
      "callToAction": "View on Instagram",
      "url": "https://www.instagram.com/mjtdev"
    },
    {
      "callToAction": "View on Minds",
      "url": "https://www.minds.com/mjtdev"
    },
    {
      "callToAction": "View on ArtStation",
      "url": "https://mjtdev.artstation.com"
    },
    {
      "callToAction": "Buy on Redbubble",
      "url": "https://www.redbubble.com/people/truepurpose/shop"
    },
    {
      "callToAction": "Own the NFT",
      "url": "https://opensea.io/collection/mjt-dev"
    }
  ],
  "artId": "art-6j4cud-kpapg7nz",
  "description": "\"Delicate Care\"\n\nThe comfort found in being comforted\n\n\n\nHigh resolution image on my website\n\nhttps://mjt.dev/art-6j4cud-kpapg7nz\n\nLinks to more of my work in my profile\n\nThanks :)\n\n---IG---\n#abstractdigital #artcollection #artcontemporain #artdesign #artinstadaily #artoftheday #arttherapy #artview #careful #contemporaryart #creativegrammer #creativityeveryday #dailyabstract #dark #decorativeart #decorativearts #delicate #digitalart #digitalpainters #distortionart #expressiveart #figurepainting #fineart #instaartoftheday #interiordesigner #newaesthetic #paintingoftheday #soft #techspressionism #unitedbyedit\n\n---ArtStation---\n#abstract #art #artist #artoftheday #dart #digitalart #illustration #painting\n\n---Minds---\n#art #artcommunity #artfinderapril #creativecommunity #myart\n\n---Redbubble---\n#abstract #artist #expressionist #mjtdev\n\n"
}