{
  "backgroundColor": "rgb(128, 128, 128)",
  "textColor": "rgb(21, 21, 21)",
  "title": "A New Challenge",
  "tagline": "The zest of life is difficulty",
  "property": {
    "artist": "Matthew Joseph Taylor",
    "mediatype": "image/png",
    "year": 2021,
    "style": [
      "Abstract",
      "Expressionist"
    ]
  },
  "hashTag": {
    "IG": [
      "abstractart",
      "abstractart_daily",
      "abstractdigitalart",
      "abstractexpressionism",
      "amazingabstracts",
      "artobserved",
      "arttherapy",
      "artview",
      "codeart",
      "contemporaryexpressionism",
      "dailyabstract",
      "darkart",
      "darkartwork",
      "darksurrealism",
      "deepart",
      "digitalart",
      "digitalpainters",
      "figurativeabstract",
      "figurepainting",
      "fineart",
      "generativeart",
      "head",
      "instaart",
      "modernabstract",
      "newmediaart",
      "nft",
      "techspressionism",
      "thecreatart",
      "theuniversalart",
      "unitedbyedit"
    ],
    "ArtStation": [
      "abstract",
      "art",
      "artist",
      "artoftheday",
      "dart",
      "digitalart",
      "illustration",
      "painting"
    ],
    "Minds": [
      "artfinder",
      "artwork",
      "creativecommunity",
      "digitalart",
      "myart"
    ],
    "Redbubble": [
      "abstract",
      "artist",
      "expressionist",
      "mjtdev"
    ]
  },
  "action": [
    {
      "callToAction": "View on Instagram",
      "url": "https://www.instagram.com/mjtdev"
    },
    {
      "callToAction": "View on Minds",
      "url": "https://www.minds.com/mjtdev"
    },
    {
      "callToAction": "View on ArtStation",
      "url": "https://mjtdev.artstation.com"
    },
    {
      "callToAction": "Buy on Redbubble",
      "url": "https://www.redbubble.com/people/truepurpose/shop"
    },
    {
      "callToAction": "Own the NFT",
      "url": "https://opensea.io/collection/mjt-dev"
    }
  ],
  "artId": "art-jduxzn-kphmtlew",
  "description": "\"A New Challenge\"\n\nThe zest of life is difficulty\n\n\n\nHigh resolution image on my website\n\nhttps://mjt.dev/art-jduxzn-kphmtlew\n\nLinks to more of my work in my profile\n\nThanks :)\n\n---IG---\n#abstractart #abstractart_daily #abstractdigitalart #abstractexpressionism #amazingabstracts #artobserved #arttherapy #artview #codeart #contemporaryexpressionism #dailyabstract #darkart #darkartwork #darksurrealism #deepart #digitalart #digitalpainters #figurativeabstract #figurepainting #fineart #generativeart #head #instaart #modernabstract #newmediaart #nft #techspressionism #thecreatart #theuniversalart #unitedbyedit\n\n---ArtStation---\n#abstract #art #artist #artoftheday #dart #digitalart #illustration #painting\n\n---Minds---\n#artfinder #artwork #creativecommunity #digitalart #myart\n\n---Redbubble---\n#abstract #artist #expressionist #mjtdev\n\n"
}