{
  "backgroundColor": "rgb(233, 228, 225)",
  "textColor": "rgb(96, 96, 96)",
  "title": "Reality Unleashed",
  "tagline": "The world is more than it appears",
  "notes": "\n\nI love how the colors dance and sing on this piece.\n\nThe unusual pallet produces a lot of interest to what otherwise might be a boring scene.\n\nThe sky is where all the real action is. \n\nHighly recommend taking a look at the high-res image on my website for this one.\n\nProcess details: \n\nI'm using custom software I'm developing to produce these images.\n\nTypescript, and HTML canvas are my present foundational tools, my virtual equivalents of traditional brushes, pigment and surface.\n\nI sample from reference images and 'extract' different things from them (colors, shapes, textures, etc...).\n\nI then refine and recombine the 'extracts' looking for something that speaks to me.\n\nOften I'm programming at the same time, tweaking and adding new processing capabilities to the software.\n\nThe end result is a large SVG built up of several layers.\n\nEach layer serves a specific visual purpose, much like how one would do a traditional painting (underpainting, tone, line, etc..).\n\nThe final SVG is usually around 50-150mb in size.\n \nThe balance between programming and art I find pleases my soul.\n",
  "property": {
    "artist": "Matthew Joseph Taylor",
    "mediatype": "image/png",
    "year": 2021,
    "style": [
      "Abstract",
      "Expressionist"
    ]
  },
  "hashTag": {
    "IG": [
      "abstractdigitalart",
      "abstractexpressionism",
      "archdrawing",
      "architecturesketch",
      "art_seeking",
      "artview",
      "artwillsaveus",
      "buildingsketch",
      "citydrawing",
      "codeart",
      "contemporaryart",
      "contemporaryexpressionism",
      "creativegrammer",
      "deepart",
      "fineart",
      "fineliner",
      "generativeart",
      "housesketch",
      "illustration",
      "modernabstract",
      "newaesthetic",
      "newmediaart",
      "nft",
      "techspressionism",
      "thecreatart",
      "theuniversalart",
      "unitedbyedit",
      "urbansketcher",
      "urbansketching",
      "usk"
    ],
    "ArtStation": [
      "abstract",
      "art",
      "artist",
      "artoftheday",
      "dart",
      "digitalart",
      "illustration",
      "painting"
    ],
    "Minds": [
      "art",
      "artfinder",
      "artistsonminds",
      "artwork",
      "painting"
    ],
    "Redbubble": [
      "abstract",
      "artist",
      "expressionist",
      "mjtdev"
    ]
  },
  "action": [
    {
      "callToAction": "View on Instagram",
      "url": "https://www.instagram.com/mjtdev"
    },
    {
      "callToAction": "View on Minds",
      "url": "https://www.minds.com/mjtdev"
    },
    {
      "callToAction": "View on ArtStation",
      "url": "https://mjtdev.artstation.com"
    },
    {
      "callToAction": "Buy on Redbubble",
      "url": "https://www.redbubble.com/people/truepurpose/shop"
    },
    {
      "callToAction": "Own the NFT",
      "url": "https://opensea.io/collection/mjt-dev"
    }
  ],
  "artId": "art-1fmzzf4-kpy2qgcr",
  "description": "\"Reality Unleashed\"\n\nThe world is more than it appears\n\n\n\nI love how the colors dance and sing on this piece.\n\nThe unusual pallet produces a lot of interest to what otherwise might be a boring scene.\n\nThe sky is where all the real action is. \n\nHighly recommend taking a look at the high-res image on my website for this one.\n\nProcess details: \n\nI'm using custom software I'm developing to produce these images.\n\nTypescript, and HTML canvas are my present foundational tools, my virtual equivalents of traditional brushes, pigment and surface.\n\nI sample from reference images and 'extract' different things from them (colors, shapes, textures, etc...).\n\nI then refine and recombine the 'extracts' looking for something that speaks to me.\n\nOften I'm programming at the same time, tweaking and adding new processing capabilities to the software.\n\nThe end result is a large SVG built up of several layers.\n\nEach layer serves a specific visual purpose, much like how one would do a traditional painting (underpainting, tone, line, etc..).\n\nThe final SVG is usually around 50-150mb in size.\n \nThe balance between programming and art I find pleases my soul.\n\n\nHigh resolution image on my website\n\nhttps://mjt.dev/art-1fmzzf4-kpy2qgcr\n\nLinks to more of my work in my profile\n\nThanks :)\n\n---IG---\n#abstractdigitalart #abstractexpressionism #archdrawing #architecturesketch #art_seeking #artview #artwillsaveus #buildingsketch #citydrawing #codeart #contemporaryart #contemporaryexpressionism #creativegrammer #deepart #fineart #fineliner #generativeart #housesketch #illustration #modernabstract #newaesthetic #newmediaart #nft #techspressionism #thecreatart #theuniversalart #unitedbyedit #urbansketcher #urbansketching #usk\n\n---ArtStation---\n#abstract #art #artist #artoftheday #dart #digitalart #illustration #painting\n\n---Minds---\n#art #artfinder #artistsonminds #artwork #painting\n\n---Redbubble---\n#abstract #artist #expressionist #mjtdev\n\n"
}