{
  "backgroundColor": "rgb(128, 128, 128)",
  "textColor": "rgb(21, 21, 21)",
  "title": "Acceptance",
  "tagline": "When the cost of change comes too high",
  "property": {
    "artist": "Matthew Joseph Taylor",
    "mediatype": "image/png",
    "year": 2021,
    "style": [
      "Abstract",
      "Expressionist"
    ]
  },
  "hashTag": {
    "IG": [
      "abstractart_daily",
      "abstractdigitalart",
      "acceptance",
      "amazingabstracts",
      "artforyourhome",
      "artobserved",
      "arttherapy",
      "artwillsaveus",
      "codeart",
      "collectibledesign",
      "contemporaryart",
      "contemporaryexpressionism",
      "creativegrammer",
      "creativityeveryday",
      "darkartwork",
      "darksurrealism",
      "deepart",
      "figurativeabstract",
      "figurativeartist",
      "instaart",
      "instaartoftheday",
      "loss",
      "modernabstract",
      "mourning",
      "newaesthetic",
      "originalart",
      "paintingoftheday",
      "techspressionism",
      "unitedbyedit",
      "visualfodder"
    ],
    "ArtStation": [
      "abstract",
      "art",
      "artist",
      "artoftheday",
      "dart",
      "digitalart",
      "illustration",
      "painting"
    ],
    "Minds": [
      "artfinder",
      "artist",
      "artwork",
      "digitalart",
      "myart"
    ],
    "Redbubble": [
      "abstract",
      "artist",
      "expressionist",
      "mjtdev"
    ]
  },
  "action": [
    {
      "callToAction": "View on Instagram",
      "url": "https://www.instagram.com/mjtdev"
    },
    {
      "callToAction": "View on Minds",
      "url": "https://www.minds.com/mjtdev"
    },
    {
      "callToAction": "View on ArtStation",
      "url": "https://mjtdev.artstation.com"
    },
    {
      "callToAction": "Buy on Redbubble",
      "url": "https://www.redbubble.com/people/truepurpose/shop"
    },
    {
      "callToAction": "Own the NFT",
      "url": "https://opensea.io/collection/mjt-dev"
    }
  ],
  "artId": "art-1vzokkt-kpbsleqe",
  "description": "\"Acceptance\"\n\nWhen the cost of change comes too high\n\n\n\nHigh resolution image on my website\n\nhttps://mjt.dev/art-1vzokkt-kpbsleqe\n\nLinks to more of my work in my profile\n\nThanks :)\n\n---IG---\n#abstractart_daily #abstractdigitalart #acceptance #amazingabstracts #artforyourhome #artobserved #arttherapy #artwillsaveus #codeart #collectibledesign #contemporaryart #contemporaryexpressionism #creativegrammer #creativityeveryday #darkartwork #darksurrealism #deepart #figurativeabstract #figurativeartist #instaart #instaartoftheday #loss #modernabstract #mourning #newaesthetic #originalart #paintingoftheday #techspressionism #unitedbyedit #visualfodder\n\n---ArtStation---\n#abstract #art #artist #artoftheday #dart #digitalart #illustration #painting\n\n---Minds---\n#artfinder #artist #artwork #digitalart #myart\n\n---Redbubble---\n#abstract #artist #expressionist #mjtdev\n\n"
}