{
  "backgroundColor": "rgb(191, 191, 191)",
  "textColor": "rgb(74, 74, 74)",
  "title": "City by the Sun",
  "tagline": "Civilized paradise",
  "property": {
    "artist": "Matthew Joseph Taylor",
    "mediatype": "image/png",
    "year": 2021,
    "style": [
      "Abstract",
      "Expressionist"
    ]
  },
  "hashTag": {
    "IG": [
      "abstractart_daily",
      "abstractdigital",
      "abstractdigitalart",
      "abstractexpressionism",
      "artobserved",
      "artoftheday",
      "arttherapy",
      "artview",
      "artwillsaveus",
      "citydrawing",
      "codeart",
      "contemporaryart",
      "contemporaryexpressionism",
      "deepart",
      "digitalart",
      "digitalpainters",
      "distortionart",
      "fineart",
      "houseportrait",
      "illustration",
      "instaart",
      "nft",
      "techspressionism",
      "theuniversalart",
      "unitedbyedit",
      "urbansketch",
      "urbansketcher",
      "urbansketching",
      "usk",
      "visualfodder"
    ],
    "ArtStation": [
      "abstract",
      "art",
      "artist",
      "artoftheday",
      "dart",
      "digitalart",
      "illustration",
      "painting"
    ],
    "Minds": [
      "art",
      "artcommunity",
      "artist",
      "artistsonminds",
      "creativecommunity"
    ],
    "Redbubble": [
      "abstract",
      "artist",
      "expressionist",
      "mjtdev"
    ]
  },
  "action": [
    {
      "callToAction": "View on Instagram",
      "url": "https://www.instagram.com/mjtdev"
    },
    {
      "callToAction": "View on Minds",
      "url": "https://www.minds.com/mjtdev"
    },
    {
      "callToAction": "View on ArtStation",
      "url": "https://mjtdev.artstation.com"
    },
    {
      "callToAction": "Buy on Redbubble",
      "url": "https://www.redbubble.com/people/truepurpose/shop"
    },
    {
      "callToAction": "Own the NFT",
      "url": "https://opensea.io/collection/mjt-dev"
    }
  ],
  "artId": "art-1sxw3et-kpp9y922",
  "description": "\"City by the Sun\"\n\nCivilized paradise\n\n\n\nHigh resolution image on my website\n\nhttps://mjt.dev/art-1sxw3et-kpp9y922\n\nLinks to more of my work in my profile\n\nThanks :)\n\n---IG---\n#abstractart_daily #abstractdigital #abstractdigitalart #abstractexpressionism #artobserved #artoftheday #arttherapy #artview #artwillsaveus #citydrawing #codeart #contemporaryart #contemporaryexpressionism #deepart #digitalart #digitalpainters #distortionart #fineart #houseportrait #illustration #instaart #nft #techspressionism #theuniversalart #unitedbyedit #urbansketch #urbansketcher #urbansketching #usk #visualfodder\n\n---ArtStation---\n#abstract #art #artist #artoftheday #dart #digitalart #illustration #painting\n\n---Minds---\n#art #artcommunity #artist #artistsonminds #creativecommunity\n\n---Redbubble---\n#abstract #artist #expressionist #mjtdev\n\n"
}