{
  "backgroundColor": "rgb(128, 128, 128)",
  "textColor": "rgb(21, 21, 21)",
  "title": "Carefree",
  "tagline": "To struggle is to live. Yet we crave the end of our struggles in life. How odd.",
  "property": {
    "artist": "Matthew Joseph Taylor",
    "mediatype": "image/png",
    "year": 2021,
    "style": [
      "Abstract",
      "Expressionist"
    ]
  },
  "hashTag": {
    "IG": [
      "abstractart",
      "abstractdigital",
      "abstractdigitalart",
      "abstractexpressionism",
      "artobserved",
      "artoftheday",
      "carefree",
      "codeart",
      "contemporaryart",
      "contemporaryexpressionism",
      "dailyabstract",
      "dark",
      "darkartwork",
      "darksurrealism",
      "deepart",
      "delusion",
      "digitalart",
      "digitalpainters",
      "distortionart",
      "face",
      "figurativeabstract",
      "figurepainting",
      "fineart",
      "generativeart",
      "happyness",
      "illusion",
      "newmediaart",
      "techspressionism",
      "theuniversalart",
      "unitedbyedit"
    ],
    "ArtStation": [
      "abstract",
      "art",
      "artist",
      "artoftheday",
      "dart",
      "digitalart",
      "illustration",
      "painting"
    ],
    "Minds": [
      "art",
      "artfinderapril",
      "artistsonminds",
      "artth",
      "creativecommunity"
    ],
    "Redbubble": [
      "abstract",
      "artist",
      "expressionist",
      "mjtdev"
    ]
  },
  "action": [
    {
      "callToAction": "View on Instagram",
      "url": "https://www.instagram.com/mjtdev"
    },
    {
      "callToAction": "View on Minds",
      "url": "https://www.minds.com/mjtdev"
    },
    {
      "callToAction": "View on ArtStation",
      "url": "https://mjtdev.artstation.com"
    },
    {
      "callToAction": "Buy on Redbubble",
      "url": "https://www.redbubble.com/people/truepurpose/shop"
    },
    {
      "callToAction": "Own the NFT",
      "url": "https://opensea.io/collection/mjt-dev"
    }
  ],
  "artId": "art-13bt43z-koyx47e9",
  "description": "\"Carefree\"\nTo struggle is to live. Yet we crave the end of our struggles in life. How odd.\n\nHigh resolution image, owning, etc...\n\nhttps://mjt.dev/art-13bt43z-koyx47e9\n\nLink in profile.\n\nThanks :)\n\n---IG---\n#abstractart #abstractdigital #abstractdigitalart #abstractexpressionism #artobserved #artoftheday #carefree #codeart #contemporaryart #contemporaryexpressionism #dailyabstract #dark #darkartwork #darksurrealism #deepart #delusion #digitalart #digitalpainters #distortionart #face #figurativeabstract #figurepainting #fineart #generativeart #happyness #illusion #newmediaart #techspressionism #theuniversalart #unitedbyedit\n\n---ArtStation---\n#abstract #art #artist #artoftheday #dart #digitalart #illustration #painting\n\n---Minds---\n#art #artfinderapril #artistsonminds #artth #creativecommunity\n\n---Redbubble---\n#abstract #artist #expressionist #mjtdev\n\n"
}