{
  "backgroundColor": "rgb(204, 201, 191)",
  "textColor": "rgb(85, 85, 85)",
  "title": "Fair Land",
  "tagline": "We all need a place to escape to",
  "property": {
    "artist": "Matthew Joseph Taylor",
    "mediatype": "image/png",
    "year": 2021,
    "style": [
      "Abstract",
      "Expressionist"
    ]
  },
  "hashTag": {
    "IG": [
      "abstractart",
      "abstractdigital",
      "abstractexpressionism",
      "amazingabstracts",
      "arch_more",
      "archdrawing",
      "architecturesketch",
      "artview",
      "buildingsketch",
      "citydrawing",
      "codeart",
      "contemporaryart",
      "contemporaryexpressionism",
      "creativegrammer",
      "dailyabstract",
      "figurepainting",
      "fineart",
      "fineliner",
      "generativeart",
      "houseportrait",
      "housesketch",
      "instaart",
      "newmediaart",
      "sketchcollector",
      "techspressionism",
      "thecreatart",
      "urbansketch",
      "urbansketching",
      "usk",
      "visualfodder"
    ],
    "ArtStation": [
      "abstract",
      "art",
      "artist",
      "artoftheday",
      "dart",
      "digitalart",
      "illustration",
      "painting"
    ],
    "Minds": [
      "art",
      "artcommunity",
      "artfinder",
      "artistsonminds",
      "artwork"
    ],
    "Redbubble": [
      "abstract",
      "artist",
      "expressionist",
      "mjtdev"
    ]
  },
  "action": [
    {
      "callToAction": "View on Instagram",
      "url": "https://www.instagram.com/mjtdev"
    },
    {
      "callToAction": "View on Minds",
      "url": "https://www.minds.com/mjtdev"
    },
    {
      "callToAction": "View on ArtStation",
      "url": "https://mjtdev.artstation.com"
    },
    {
      "callToAction": "Buy on Redbubble",
      "url": "https://www.redbubble.com/people/truepurpose/shop"
    },
    {
      "callToAction": "Own the NFT",
      "url": "https://opensea.io/collection/mjt-dev"
    }
  ],
  "artId": "art-1vdrrly-kpruzteb",
  "description": "\"Fair Land\"\n\nWe all need a place to escape to\n\n\n\nHigh resolution image on my website\n\nhttps://mjt.dev/art-1vdrrly-kpruzteb\n\nLinks to more of my work in my profile\n\nThanks :)\n\n---IG---\n#abstractart #abstractdigital #abstractexpressionism #amazingabstracts #arch_more #archdrawing #architecturesketch #artview #buildingsketch #citydrawing #codeart #contemporaryart #contemporaryexpressionism #creativegrammer #dailyabstract #figurepainting #fineart #fineliner #generativeart #houseportrait #housesketch #instaart #newmediaart #sketchcollector #techspressionism #thecreatart #urbansketch #urbansketching #usk #visualfodder\n\n---ArtStation---\n#abstract #art #artist #artoftheday #dart #digitalart #illustration #painting\n\n---Minds---\n#art #artcommunity #artfinder #artistsonminds #artwork\n\n---Redbubble---\n#abstract #artist #expressionist #mjtdev\n\n"
}