{
  "backgroundColor": "rgb(191, 191, 191)",
  "textColor": "rgb(74, 74, 74)",
  "title": "Renewing Strength",
  "tagline": "We grow stronger over time",
  "property": {
    "artist": "Matthew Joseph Taylor",
    "mediatype": "image/png",
    "year": 2021,
    "style": [
      "Abstract",
      "Expressionist"
    ]
  },
  "hashTag": {
    "IG": [
      "abstractart",
      "abstractdigital",
      "abstractdigitalart",
      "abstractexpressionism",
      "amazingabstracts",
      "artobserved",
      "arttherapy",
      "artview",
      "artwillsaveus",
      "codeart",
      "contemporaryart",
      "contemporaryexpressionism",
      "dark",
      "darkart",
      "darkartwork",
      "darksurrealism",
      "deepart",
      "digitalpainters",
      "distortionart",
      "figurativeartist",
      "fineart",
      "generativeart",
      "head",
      "instaart",
      "mastersofdarkart",
      "newmediaart",
      "techspressionism",
      "thecreatart",
      "theuniversalart",
      "unitedbyedit"
    ],
    "ArtStation": [
      "abstract",
      "art",
      "artist",
      "artoftheday",
      "dart",
      "digitalart",
      "illustration",
      "painting"
    ],
    "Minds": [
      "artistsonminds",
      "artwork",
      "creativecommunity",
      "myart",
      "painting"
    ],
    "Redbubble": [
      "abstract",
      "artist",
      "expressionist",
      "mjtdev"
    ]
  },
  "action": [
    {
      "callToAction": "View on Instagram",
      "url": "https://www.instagram.com/mjtdev"
    },
    {
      "callToAction": "View on Minds",
      "url": "https://www.minds.com/mjtdev"
    },
    {
      "callToAction": "View on ArtStation",
      "url": "https://mjtdev.artstation.com"
    },
    {
      "callToAction": "Buy on Redbubble",
      "url": "https://www.redbubble.com/people/truepurpose/shop"
    },
    {
      "callToAction": "Own the NFT",
      "url": "https://opensea.io/collection/mjt-dev"
    }
  ],
  "artId": "art-uyy005-kpnrisvw",
  "description": "\"Renewing Strength\"\n\nWe grow stronger over time\n\n\n\nHigh resolution image on my website\n\nhttps://mjt.dev/art-uyy005-kpnrisvw\n\nLinks to more of my work in my profile\n\nThanks :)\n\n---IG---\n#abstractart #abstractdigital #abstractdigitalart #abstractexpressionism #amazingabstracts #artobserved #arttherapy #artview #artwillsaveus #codeart #contemporaryart #contemporaryexpressionism #dark #darkart #darkartwork #darksurrealism #deepart #digitalpainters #distortionart #figurativeartist #fineart #generativeart #head #instaart #mastersofdarkart #newmediaart #techspressionism #thecreatart #theuniversalart #unitedbyedit\n\n---ArtStation---\n#abstract #art #artist #artoftheday #dart #digitalart #illustration #painting\n\n---Minds---\n#artistsonminds #artwork #creativecommunity #myart #painting\n\n---Redbubble---\n#abstract #artist #expressionist #mjtdev\n\n"
}