{
  "backgroundColor": "rgb(128, 128, 128)",
  "textColor": "rgb(21, 21, 21)",
  "title": "Mischief in the Making",
  "tagline": "It all begins with an idea",
  "property": {
    "artist": "Matthew Joseph Taylor",
    "mediatype": "image/png",
    "year": 2021,
    "style": [
      "Abstract",
      "Expressionist"
    ]
  },
  "hashTag": {
    "IG": [
      "abstractart",
      "abstractartorg",
      "abstractdigital",
      "abstractdigitalart",
      "abstractexpressionism",
      "artobserved",
      "contemporaryart",
      "contemporaryexpressionism",
      "dark",
      "darkart",
      "darksurrealism",
      "deepart",
      "digitalart",
      "digitalpainters",
      "distortionart",
      "figurativeartist",
      "imagine",
      "mafia_editlove",
      "mischief",
      "newaesthetic",
      "newmediaart",
      "nft",
      "playful",
      "redbubbleartists",
      "spookyart",
      "techspressionism",
      "thinking",
      "trouble",
      "unitedbyedit",
      "visualfodder"
    ],
    "ArtStation": [
      "abstract",
      "art",
      "artist",
      "artoftheday",
      "dart",
      "digitalart",
      "illustration",
      "painting"
    ],
    "Minds": [
      "art",
      "artfinderapril",
      "artistsonminds",
      "artth",
      "artwork"
    ],
    "Redbubble": [
      "abstract",
      "artist",
      "expressionist",
      "mjtdev"
    ]
  },
  "action": [
    {
      "callToAction": "View on Instagram",
      "url": "https://www.instagram.com/mjtdev"
    },
    {
      "callToAction": "View on Minds",
      "url": "https://www.minds.com/mjtdev"
    },
    {
      "callToAction": "View on ArtStation",
      "url": "https://mjtdev.artstation.com"
    },
    {
      "callToAction": "Buy on Redbubble",
      "url": "https://www.redbubble.com/people/truepurpose/shop"
    },
    {
      "callToAction": "Own the NFT",
      "url": "https://opensea.io/collection/mjt-dev"
    }
  ],
  "artId": "art-118m9qz-ko0vxg2g",
  "description": "\"Mischief in the Making\"\nIt all begins with an idea\n\nHigh resolution image, owning, etc...\n\nhttps://mjt.dev/art-118m9qz-ko0vxg2g\n\nLink in profile.\n\nThanks :)\n\n---IG---\n#abstractart #abstractartorg #abstractdigital #abstractdigitalart #abstractexpressionism #artobserved #contemporaryart #contemporaryexpressionism #dark #darkart #darksurrealism #deepart #digitalart #digitalpainters #distortionart #figurativeartist #imagine #mafia_editlove #mischief #newaesthetic #newmediaart #nft #playful #redbubbleartists #spookyart #techspressionism #thinking #trouble #unitedbyedit #visualfodder\n\n---ArtStation---\n#abstract #art #artist #artoftheday #dart #digitalart #illustration #painting\n\n---Minds---\n#art #artfinderapril #artistsonminds #artth #artwork\n\n---Redbubble---\n#abstract #artist #expressionist #mjtdev\n\n"
}