{
  "backgroundColor": "rgb(234, 234, 234)",
  "textColor": "rgb(96, 96, 96)",
  "title": "Scream Into Life",
  "tagline": "Rage is a useful emotion, not to be ignored.",
  "property": {
    "artist": "Matthew Joseph Taylor",
    "mediatype": "image/png",
    "year": 2021,
    "style": [
      "Abstract",
      "Expressionist"
    ]
  },
  "hashTag": {
    "IG": [
      "abstractart",
      "abstractartorg",
      "abstractdigital",
      "abstractdigitalart",
      "abstractexpressionism",
      "anger",
      "artobserved",
      "artoftheday",
      "blackarts",
      "codeart",
      "contemporaryart",
      "dark",
      "darkart",
      "darkartwork",
      "darksurrealism",
      "deepart",
      "digitalart",
      "emotion",
      "figurativeartists",
      "fineart",
      "mafia_editlove",
      "newaesthetic",
      "nft",
      "rage",
      "scream",
      "spookyart",
      "thecreatart",
      "theuniversalart",
      "unitedbyedit",
      "visualfodder"
    ],
    "ArtStation": [
      "abstract",
      "art",
      "artist",
      "artoftheday",
      "dart",
      "digitalart",
      "illustration",
      "painting"
    ],
    "Minds": [
      "artcommunity",
      "artistsonminds",
      "artwork",
      "creativecommunity",
      "myart"
    ],
    "Redbubble": [
      "abstract",
      "artist",
      "expressionist",
      "mjtdev"
    ]
  },
  "action": [
    {
      "callToAction": "View on Instagram",
      "url": "https://www.instagram.com/mjtdev"
    },
    {
      "callToAction": "View on Minds",
      "url": "https://www.minds.com/mjtdev"
    },
    {
      "callToAction": "View on ArtStation",
      "url": "https://mjtdev.artstation.com"
    },
    {
      "callToAction": "Buy on Redbubble",
      "url": "https://www.redbubble.com/people/truepurpose/shop"
    },
    {
      "callToAction": "Own the NFT",
      "url": "https://opensea.io/collection/mjt-dev"
    }
  ],
  "artId": "art-1gjyw3o-knxouolg",
  "description": "\"Scream Into Life\"\nRage is a useful emotion, not to be ignored.\n\nHigh resolution image, owning, etc...\n\nhttps://mjt.dev/art-1gjyw3o-knxouolg\n\nLink in profile.\n\nThanks :)\n\n---IG---\n#abstractart #abstractartorg #abstractdigital #abstractdigitalart #abstractexpressionism #anger #artobserved #artoftheday #blackarts #codeart #contemporaryart #dark #darkart #darkartwork #darksurrealism #deepart #digitalart #emotion #figurativeartists #fineart #mafia_editlove #newaesthetic #nft #rage #scream #spookyart #thecreatart #theuniversalart #unitedbyedit #visualfodder\n\n---ArtStation---\n#abstract #art #artist #artoftheday #dart #digitalart #illustration #painting\n\n---Minds---\n#artcommunity #artistsonminds #artwork #creativecommunity #myart\n\n---Redbubble---\n#abstract #artist #expressionist #mjtdev\n\n"
}