{
  "backgroundColor": "rgb(42, 42, 42)",
  "textColor": "rgb(148, 148, 148)",
  "title": "Open All Night",
  "tagline": "The city provides for all its residents without judgement",
  "notes": "\nNightime in a crowded space has a bit of evil about it.\n\nAs we struggle to fight the encroaching darkness, the light we create somehow hides more than it reveals.\n\nThe harsh lights illuminate without warmth. A cold dead light.\n\nYet, if one finds oneself out and about of an evening, there is a sense of delight in the danger.\n\nA safety in the shadows. One can relax, take off the mask and just be.\n\nProcess details: \n\nI'm using custom software I'm developing to produce these images.\n\nTypescript, and HTML canvas are my present foundational tools, my virtual equivalents of traditional brushes, pigment and surface.\n\nI sample from reference images and 'extract' different things from them (colors, shapes, textures, etc...).\n\nI then refine and recombine the 'extracts' looking for something that speaks to me.\n\nOften I'm programming at the same time, tweaking and adding new processing capabilities to the software.\n\nThe end result is a large SVG built up of several layers.\n\nEach layer serves a specific visual purpose, much like how one would do a traditional painting (underpainting, tone, line, etc..).\n\nThe final SVG is usually around 50-150mb in size.\n \nThe balance between programming and art I find pleases my soul.\n",
  "property": {
    "artist": "Matthew Joseph Taylor",
    "mediatype": "image/png",
    "year": 2021,
    "style": [
      "Abstract",
      "Expressionist"
    ]
  },
  "hashTag": {
    "IG": [
      "abstractart",
      "abstractart_daily",
      "abstractdigital",
      "abstractexpressionism",
      "architecturesketch",
      "artoftheday",
      "arttherapy",
      "artview",
      "buildingsketch",
      "codeart",
      "contemporaryart",
      "dark",
      "figurepainting",
      "fineart",
      "fineliner",
      "mastersofdarkart",
      "modernabstract",
      "newaesthetic",
      "newmediaart",
      "nft",
      "proceduralart",
      "sketchcollector",
      "surrealism",
      "techspressionism",
      "thecreatart",
      "urbansketch",
      "urbansketcher",
      "usk",
      "viewartgallery",
      "visualfodder"
    ],
    "ArtStation": [
      "abstract",
      "art",
      "artist",
      "artoftheday",
      "dart",
      "digitalart",
      "illustration",
      "painting"
    ],
    "Minds": [
      "art",
      "artfinder",
      "artwork",
      "creativecommunity",
      "digitalart"
    ],
    "Redbubble": [
      "abstract",
      "artist",
      "expressionist",
      "mjtdev"
    ]
  },
  "action": [
    {
      "callToAction": "View on Instagram",
      "url": "https://www.instagram.com/mjtdev"
    },
    {
      "callToAction": "View on Minds",
      "url": "https://www.minds.com/mjtdev"
    },
    {
      "callToAction": "View on ArtStation",
      "url": "https://mjtdev.artstation.com"
    },
    {
      "callToAction": "Buy on Redbubble",
      "url": "https://www.redbubble.com/people/truepurpose/shop"
    },
    {
      "callToAction": "Own the NFT",
      "url": "https://opensea.io/collection/mjt-dev"
    }
  ],
  "artId": "art-q5d821-kq1han1u",
  "description": "\"Open All Night\"\n\nThe city provides for all its residents without judgement\n\n\nNightime in a crowded space has a bit of evil about it.\n\nAs we struggle to fight the encroaching darkness, the light we create somehow hides more than it reveals.\n\nThe harsh lights illuminate without warmth. A cold dead light.\n\nYet, if one finds oneself out and about of an evening, there is a sense of delight in the danger.\n\nA safety in the shadows. One can relax, take off the mask and just be.\n\nProcess details: \n\nI'm using custom software I'm developing to produce these images.\n\nTypescript, and HTML canvas are my present foundational tools, my virtual equivalents of traditional brushes, pigment and surface.\n\nI sample from reference images and 'extract' different things from them (colors, shapes, textures, etc...).\n\nI then refine and recombine the 'extracts' looking for something that speaks to me.\n\nOften I'm programming at the same time, tweaking and adding new processing capabilities to the software.\n\nThe end result is a large SVG built up of several layers.\n\nEach layer serves a specific visual purpose, much like how one would do a traditional painting (underpainting, tone, line, etc..).\n\nThe final SVG is usually around 50-150mb in size.\n \nThe balance between programming and art I find pleases my soul.\n\n\nHigh resolution image on my website\n\nhttps://mjt.dev/art-q5d821-kq1han1u\n\nLinks to more of my work in my profile\n\nThanks :)\n\n---IG---\n#abstractart #abstractart_daily #abstractdigital #abstractexpressionism #architecturesketch #artoftheday #arttherapy #artview #buildingsketch #codeart #contemporaryart #dark #figurepainting #fineart #fineliner #mastersofdarkart #modernabstract #newaesthetic #newmediaart #nft #proceduralart #sketchcollector #surrealism #techspressionism #thecreatart #urbansketch #urbansketcher #usk #viewartgallery #visualfodder\n\n---ArtStation---\n#abstract #art #artist #artoftheday #dart #digitalart #illustration #painting\n\n---Minds---\n#art #artfinder #artwork #creativecommunity #digitalart\n\n---Redbubble---\n#abstract #artist #expressionist #mjtdev\n\n"
}