{
  "backgroundColor": "rgb(128, 128, 128)",
  "textColor": "rgb(21, 21, 21)",
  "title": "Wanting Attention",
  "tagline": "Beauty is attractive",
  "property": {
    "artist": "Matthew Joseph Taylor",
    "mediatype": "image/png",
    "year": 2021,
    "style": [
      "Abstract",
      "Expressionist"
    ]
  },
  "hashTag": {
    "IG": [
      "abstractart",
      "abstractdigital",
      "abstractexpressionism",
      "artobserved",
      "artview",
      "attraction",
      "attractive",
      "beautiful",
      "beauty",
      "bird",
      "birdart",
      "codeart",
      "contemporaryart",
      "dark",
      "darkart",
      "darkartwork",
      "darksurrealism",
      "deepart",
      "desire",
      "digitalart",
      "digitalpainters",
      "distortionart",
      "fineart",
      "newaesthetic",
      "newmediaart",
      "parakeet",
      "techspressionism",
      "theuniversalart",
      "unitedbyedit",
      "visualfodder"
    ],
    "ArtStation": [
      "abstract",
      "art",
      "artist",
      "artoftheday",
      "dart",
      "digitalart",
      "illustration",
      "painting"
    ],
    "Minds": [
      "art",
      "artwork",
      "creativecommunity",
      "digitalart",
      "painting"
    ],
    "Redbubble": [
      "abstract",
      "artist",
      "expressionist",
      "mjtdev"
    ]
  },
  "action": [
    {
      "callToAction": "View on Instagram",
      "url": "https://www.instagram.com/mjtdev"
    },
    {
      "callToAction": "View on Minds",
      "url": "https://www.minds.com/mjtdev"
    },
    {
      "callToAction": "View on ArtStation",
      "url": "https://mjtdev.artstation.com"
    },
    {
      "callToAction": "Buy on Redbubble",
      "url": "https://www.redbubble.com/people/truepurpose/shop"
    },
    {
      "callToAction": "Own the NFT",
      "url": "https://opensea.io/collection/mjt-dev"
    }
  ],
  "artId": "art-1n99lk5-kop1ywox",
  "description": "\"Wanting Attention\"\nBeauty is attractive\n\nHigh resolution image, owning, etc...\n\nhttps://mjt.dev/art-1n99lk5-kop1ywox\n\nLink in profile.\n\nThanks :)\n\n---IG---\n#abstractart #abstractdigital #abstractexpressionism #artobserved #artview #attraction #attractive #beautiful #beauty #bird #birdart #codeart #contemporaryart #dark #darkart #darkartwork #darksurrealism #deepart #desire #digitalart #digitalpainters #distortionart #fineart #newaesthetic #newmediaart #parakeet #techspressionism #theuniversalart #unitedbyedit #visualfodder\n\n---ArtStation---\n#abstract #art #artist #artoftheday #dart #digitalart #illustration #painting\n\n---Minds---\n#art #artwork #creativecommunity #digitalart #painting\n\n---Redbubble---\n#abstract #artist #expressionist #mjtdev\n\n"
}