{
  "backgroundColor": "rgb(128, 128, 128)",
  "textColor": "rgb(21, 21, 21)",
  "title": "Bastion",
  "tagline": "Made for tough times",
  "property": {
    "artist": "Matthew Joseph Taylor",
    "mediatype": "image/png",
    "year": 2021,
    "style": [
      "Abstract",
      "Expressionist"
    ]
  },
  "hashTag": {
    "IG": [
      "abstractdigitalart",
      "abstractexpressionism",
      "amazingabstracts",
      "archdrawing",
      "architecturesketch",
      "artobserved",
      "artoftheday",
      "arttherapy",
      "artview",
      "contemporaryart",
      "contemporaryexpressionism",
      "creativegrammer",
      "dailyabstract",
      "dailysketch",
      "deepart",
      "digitalart",
      "digitalpainters",
      "distortionart",
      "fineart",
      "fineliner",
      "generativeart",
      "illustration",
      "newaesthetic",
      "newmediaart",
      "nft",
      "thecreatart",
      "theuniversalart",
      "unitedbyedit",
      "urbansketch",
      "visualfodder"
    ],
    "ArtStation": [
      "abstract",
      "art",
      "artist",
      "artoftheday",
      "dart",
      "digitalart",
      "illustration",
      "painting"
    ],
    "Minds": [
      "art",
      "artcommunity",
      "artist",
      "artwork",
      "myart"
    ],
    "Redbubble": [
      "abstract",
      "artist",
      "expressionist",
      "mjtdev"
    ]
  },
  "action": [
    {
      "callToAction": "View on Instagram",
      "url": "https://www.instagram.com/mjtdev"
    },
    {
      "callToAction": "View on Minds",
      "url": "https://www.minds.com/mjtdev"
    },
    {
      "callToAction": "View on ArtStation",
      "url": "https://mjtdev.artstation.com"
    },
    {
      "callToAction": "Buy on Redbubble",
      "url": "https://www.redbubble.com/people/truepurpose/shop"
    },
    {
      "callToAction": "Own the NFT",
      "url": "https://opensea.io/collection/mjt-dev"
    }
  ],
  "artId": "art-q9joj-kpodj65x",
  "description": "\"Bastion\"\n\nMade for tough times\n\n\n\nHigh resolution image on my website\n\nhttps://mjt.dev/art-q9joj-kpodj65x\n\nLinks to more of my work in my profile\n\nThanks :)\n\n---IG---\n#abstractdigitalart #abstractexpressionism #amazingabstracts #archdrawing #architecturesketch #artobserved #artoftheday #arttherapy #artview #contemporaryart #contemporaryexpressionism #creativegrammer #dailyabstract #dailysketch #deepart #digitalart #digitalpainters #distortionart #fineart #fineliner #generativeart #illustration #newaesthetic #newmediaart #nft #thecreatart #theuniversalart #unitedbyedit #urbansketch #visualfodder\n\n---ArtStation---\n#abstract #art #artist #artoftheday #dart #digitalart #illustration #painting\n\n---Minds---\n#art #artcommunity #artist #artwork #myart\n\n---Redbubble---\n#abstract #artist #expressionist #mjtdev\n\n"
}