{
  "backgroundColor": "rgb(191, 191, 191)",
  "textColor": "rgb(74, 74, 74)",
  "title": "Take Your Shot",
  "tagline": "This is the moment, use it",
  "property": {
    "artist": "Matthew Joseph Taylor",
    "mediatype": "image/png",
    "year": 2021,
    "style": [
      "Abstract",
      "Expressionist"
    ]
  },
  "hashTag": {
    "IG": [
      "abstractart",
      "abstractdigital",
      "action",
      "alive",
      "artobserved",
      "artoftheday",
      "artview",
      "codeart",
      "contemporaryart",
      "contemporaryexpressionism",
      "dark",
      "darkart",
      "darkartwork",
      "darksurrealism",
      "deepart",
      "digitalart",
      "digitalpainters",
      "distortionart",
      "energy",
      "figurativeabstract",
      "figurativeartist",
      "figurativeartists",
      "fineart",
      "newaesthetic",
      "newmediaart",
      "nft",
      "techspressionism",
      "theuniversalart",
      "unitedbyedit",
      "visualfodder"
    ],
    "ArtStation": [
      "abstract",
      "art",
      "artist",
      "artoftheday",
      "dart",
      "digitalart",
      "illustration",
      "painting"
    ],
    "Minds": [
      "art",
      "artfinderapril",
      "artistsonminds",
      "artth",
      "painting"
    ],
    "Redbubble": [
      "abstract",
      "artist",
      "expressionist",
      "mjtdev"
    ]
  },
  "action": [
    {
      "callToAction": "View on Instagram",
      "url": "https://www.instagram.com/mjtdev"
    },
    {
      "callToAction": "View on Minds",
      "url": "https://www.minds.com/mjtdev"
    },
    {
      "callToAction": "View on ArtStation",
      "url": "https://mjtdev.artstation.com"
    },
    {
      "callToAction": "Buy on Redbubble",
      "url": "https://www.redbubble.com/people/truepurpose/shop"
    },
    {
      "callToAction": "Own the NFT",
      "url": "https://opensea.io/collection/mjt-dev"
    }
  ],
  "artId": "art-1g151yx-ko7x5khj",
  "description": "\"Take Your Shot\"\nThis is the moment, use it\n\nHigh resolution image, owning, etc...\n\nhttps://mjt.dev/art-1g151yx-ko7x5khj\n\nLink in profile.\n\nThanks :)\n\n---IG---\n#abstractart #abstractdigital #action #alive #artobserved #artoftheday #artview #codeart #contemporaryart #contemporaryexpressionism #dark #darkart #darkartwork #darksurrealism #deepart #digitalart #digitalpainters #distortionart #energy #figurativeabstract #figurativeartist #figurativeartists #fineart #newaesthetic #newmediaart #nft #techspressionism #theuniversalart #unitedbyedit #visualfodder\n\n---ArtStation---\n#abstract #art #artist #artoftheday #dart #digitalart #illustration #painting\n\n---Minds---\n#art #artfinderapril #artistsonminds #artth #painting\n\n---Redbubble---\n#abstract #artist #expressionist #mjtdev\n\n"
}