{
  "backgroundColor": "rgb(234, 234, 234)",
  "textColor": "rgb(96, 96, 96)",
  "title": "By Any Other Name",
  "tagline": "Nature needs no words",
  "property": {
    "artist": "Matthew Joseph Taylor",
    "mediatype": "image/png",
    "year": 2021,
    "style": [
      "Abstract",
      "Expressionist"
    ]
  },
  "hashTag": {
    "IG": [
      "abstractart",
      "abstractdigital",
      "abstractexpressionism",
      "artobserved",
      "artoftheday",
      "arttherapy",
      "artview",
      "codeart",
      "contemporaryart",
      "contemporaryexpressionism",
      "dailyabstract",
      "deepart",
      "delicate",
      "digitalart",
      "digitalpainters",
      "distortionart",
      "fineart",
      "flower",
      "generativeart",
      "instaart",
      "modernabstract",
      "nature",
      "newaesthetic",
      "newmediaart",
      "rose",
      "techspressionism",
      "thecreatart",
      "theuniversalart",
      "unitedbyedit",
      "visualfodder"
    ],
    "ArtStation": [
      "abstract",
      "art",
      "artist",
      "artoftheday",
      "dart",
      "digitalart",
      "illustration",
      "painting"
    ],
    "Minds": [
      "art",
      "artcommunity",
      "artist",
      "artwork",
      "digitalart"
    ],
    "Redbubble": [
      "abstract",
      "artist",
      "expressionist",
      "mjtdev"
    ]
  },
  "action": [
    {
      "callToAction": "View on Instagram",
      "url": "https://www.instagram.com/mjtdev"
    },
    {
      "callToAction": "View on Minds",
      "url": "https://www.minds.com/mjtdev"
    },
    {
      "callToAction": "View on ArtStation",
      "url": "https://mjtdev.artstation.com"
    },
    {
      "callToAction": "Buy on Redbubble",
      "url": "https://www.redbubble.com/people/truepurpose/shop"
    },
    {
      "callToAction": "Own the NFT",
      "url": "https://opensea.io/collection/mjt-dev"
    }
  ],
  "artId": "art-1pj7y59-kp3al6z7",
  "description": "\"By Any Other Name\"\nNature needs no words\n\nHigh resolution image, owning, etc...\n\nhttps://mjt.dev/art-1pj7y59-kp3al6z7\n\nLink in profile.\n\nThanks :)\n\n---IG---\n#abstractart #abstractdigital #abstractexpressionism #artobserved #artoftheday #arttherapy #artview #codeart #contemporaryart #contemporaryexpressionism #dailyabstract #deepart #delicate #digitalart #digitalpainters #distortionart #fineart #flower #generativeart #instaart #modernabstract #nature #newaesthetic #newmediaart #rose #techspressionism #thecreatart #theuniversalart #unitedbyedit #visualfodder\n\n---ArtStation---\n#abstract #art #artist #artoftheday #dart #digitalart #illustration #painting\n\n---Minds---\n#art #artcommunity #artist #artwork #digitalart\n\n---Redbubble---\n#abstract #artist #expressionist #mjtdev\n\n"
}