{
  "backgroundColor": "rgb(57, 67, 74)",
  "textColor": "rgb(181, 181, 181)",
  "title": "Future Today",
  "tagline": "We bring imagination to life",
  "notes": "\nI feel a strong sense of 'modernity shock' with this piece.\n\nThe background color was what made this for me.\n\nMuch deeper than an 'architect blue' but to my eyes it gives a similar 'industrial' quality.\n\nProcess details: \n\nThis is a large SVG built up of several layers, much like how one would do a traditional painting.\n\nThe final SVGs are usually around 50-150mb in size.\n \nWith each piece I hone the software I'm crafting to produce the images.\n \nThe balance between programming and art I find pleases my soul.\n",
  "property": {
    "artist": "Matthew Joseph Taylor",
    "mediatype": "image/png",
    "year": 2021,
    "style": [
      "Abstract",
      "Expressionist"
    ]
  },
  "hashTag": {
    "IG": [
      "abstractart",
      "abstractart_daily",
      "abstractdigital",
      "abstractdigitalart",
      "arch_more",
      "architecturesketch",
      "artobserved",
      "artoftheday",
      "arttherapy",
      "artview",
      "artwillsaveus",
      "citydrawing",
      "contemporaryart",
      "creativegrammer",
      "dailysketch",
      "deepart",
      "digitalart",
      "figurepainting",
      "fineart",
      "fineliner",
      "houseportrait",
      "housesketch",
      "illustration",
      "modernabstract",
      "newaesthetic",
      "nft",
      "theuniversalart",
      "urbansketch",
      "usk",
      "visualfodder"
    ],
    "ArtStation": [
      "abstract",
      "art",
      "artist",
      "artoftheday",
      "dart",
      "digitalart",
      "illustration",
      "painting"
    ],
    "Minds": [
      "artist",
      "artistsonminds",
      "creativecommunity",
      "digitalart",
      "painting"
    ],
    "Redbubble": [
      "abstract",
      "artist",
      "expressionist",
      "mjtdev"
    ]
  },
  "action": [
    {
      "callToAction": "View on Instagram",
      "url": "https://www.instagram.com/mjtdev"
    },
    {
      "callToAction": "View on Minds",
      "url": "https://www.minds.com/mjtdev"
    },
    {
      "callToAction": "View on ArtStation",
      "url": "https://mjtdev.artstation.com"
    },
    {
      "callToAction": "Buy on Redbubble",
      "url": "https://www.redbubble.com/people/truepurpose/shop"
    },
    {
      "callToAction": "Own the NFT",
      "url": "https://opensea.io/collection/mjt-dev"
    }
  ],
  "artId": "art-rc7alm-kpwa4cq6",
  "description": "\"Future Today\"\n\nWe bring imagination to life\n\n\nI feel a strong sense of &#x27;modernity shock&#x27; with this piece.\n\nThe background color was what made this for me.\n\nMuch deeper than an &#x27;architect blue&#x27; but to my eyes it gives a similar &#x27;industrial&#x27; quality.\n\nProcess details: \n\nThis is a large SVG built up of several layers, much like how one would do a traditional painting.\n\nThe final SVGs are usually around 50-150mb in size.\n \nWith each piece I hone the software I&#x27;m crafting to produce the images.\n \nThe balance between programming and art I find pleases my soul.\n\n\nHigh resolution image on my website\n\nhttps://mjt.dev/art-rc7alm-kpwa4cq6\n\nLinks to more of my work in my profile\n\nThanks :)\n\n---IG---\n#abstractart #abstractart_daily #abstractdigital #abstractdigitalart #arch_more #architecturesketch #artobserved #artoftheday #arttherapy #artview #artwillsaveus #citydrawing #contemporaryart #creativegrammer #dailysketch #deepart #digitalart #figurepainting #fineart #fineliner #houseportrait #housesketch #illustration #modernabstract #newaesthetic #nft #theuniversalart #urbansketch #usk #visualfodder\n\n---ArtStation---\n#abstract #art #artist #artoftheday #dart #digitalart #illustration #painting\n\n---Minds---\n#artist #artistsonminds #creativecommunity #digitalart #painting\n\n---Redbubble---\n#abstract #artist #expressionist #mjtdev\n\n"
}