{
  "backgroundColor": "rgb(90, 94, 92)",
  "textColor": "rgb(223, 223, 223)",
  "title": "Modern Oasis",
  "tagline": "The more things change, the less they remain the same",
  "property": {
    "artist": "Matthew Joseph Taylor",
    "mediatype": "image/png",
    "year": 2021,
    "style": [
      "Abstract",
      "Expressionist"
    ]
  },
  "hashTag": {
    "IG": [
      "abstractart",
      "abstractart_daily",
      "abstractdigital",
      "abstractdigitalart",
      "amazingabstracts",
      "arch_more",
      "archdrawing",
      "arttherapy",
      "artview",
      "artwillsaveus",
      "buildingsketch",
      "citydrawing",
      "codeart",
      "contemporaryart",
      "contemporaryexpressionism",
      "deepart",
      "digitalart",
      "fineliner",
      "generativeart",
      "houseportrait",
      "modernabstract",
      "newaesthetic",
      "newmediaart",
      "nft",
      "techspressionism",
      "thecreatart",
      "theuniversalart",
      "urbansketch",
      "urbansketcher",
      "visualfodder"
    ],
    "ArtStation": [
      "abstract",
      "art",
      "artist",
      "artoftheday",
      "dart",
      "digitalart",
      "illustration",
      "painting"
    ],
    "Minds": [
      "artfinder",
      "artist",
      "artistsonminds",
      "myart",
      "painting"
    ],
    "Redbubble": [
      "abstract",
      "artist",
      "expressionist",
      "mjtdev"
    ]
  },
  "action": [
    {
      "callToAction": "View on Instagram",
      "url": "https://www.instagram.com/mjtdev"
    },
    {
      "callToAction": "View on Minds",
      "url": "https://www.minds.com/mjtdev"
    },
    {
      "callToAction": "View on ArtStation",
      "url": "https://mjtdev.artstation.com"
    },
    {
      "callToAction": "Buy on Redbubble",
      "url": "https://www.redbubble.com/people/truepurpose/shop"
    },
    {
      "callToAction": "Own the NFT",
      "url": "https://opensea.io/collection/mjt-dev"
    }
  ],
  "artId": "art-s76oh1-kpqn99v7",
  "description": "\"Modern Oasis\"\n\nThe more things change, the less they remain the same\n\n\n\nHigh resolution image on my website\n\nhttps://mjt.dev/art-s76oh1-kpqn99v7\n\nLinks to more of my work in my profile\n\nThanks :)\n\n---IG---\n#abstractart #abstractart_daily #abstractdigital #abstractdigitalart #amazingabstracts #arch_more #archdrawing #arttherapy #artview #artwillsaveus #buildingsketch #citydrawing #codeart #contemporaryart #contemporaryexpressionism #deepart #digitalart #fineliner #generativeart #houseportrait #modernabstract #newaesthetic #newmediaart #nft #techspressionism #thecreatart #theuniversalart #urbansketch #urbansketcher #visualfodder\n\n---ArtStation---\n#abstract #art #artist #artoftheday #dart #digitalart #illustration #painting\n\n---Minds---\n#artfinder #artist #artistsonminds #myart #painting\n\n---Redbubble---\n#abstract #artist #expressionist #mjtdev\n\n"
}