{
  "backgroundColor": "rgb(234, 234, 234)",
  "textColor": "rgb(96, 96, 96)",
  "title": "Mother's Protection",
  "tagline": "A dangerous world made safe",
  "property": {
    "artist": "Matthew Joseph Taylor",
    "mediatype": "image/png",
    "year": 2021,
    "style": [
      "Abstract",
      "Expressionist"
    ]
  },
  "hashTag": {
    "IG": [
      "abstractart",
      "abstractdigital",
      "abstractdigitalart",
      "artobserved",
      "artoftheday",
      "artview",
      "codeart",
      "contemporaryart",
      "contemporaryexpressionism",
      "dark",
      "darkart",
      "darkartwork",
      "darksurrealism",
      "distortionart",
      "elephant",
      "elephantart",
      "fineart",
      "love",
      "loved",
      "mom",
      "momart",
      "newaesthetic",
      "newmediaart",
      "nft",
      "protected",
      "safe",
      "techspressionism",
      "thecreatart",
      "unitedbyedit",
      "visualfodder"
    ],
    "ArtStation": [
      "abstract",
      "art",
      "artist",
      "artoftheday",
      "dart",
      "digitalart",
      "illustration",
      "painting"
    ],
    "Minds": [
      "artcommunity",
      "artist",
      "artistsonminds",
      "artth",
      "artwork"
    ],
    "Redbubble": [
      "abstract",
      "artist",
      "expressionist",
      "mjtdev"
    ]
  },
  "action": [
    {
      "callToAction": "View on Instagram",
      "url": "https://www.instagram.com/mjtdev"
    },
    {
      "callToAction": "View on Minds",
      "url": "https://www.minds.com/mjtdev"
    },
    {
      "callToAction": "View on ArtStation",
      "url": "https://mjtdev.artstation.com"
    },
    {
      "callToAction": "Buy on Redbubble",
      "url": "https://www.redbubble.com/people/truepurpose/shop"
    },
    {
      "callToAction": "Own the NFT",
      "url": "https://opensea.io/collection/mjt-dev"
    }
  ],
  "artId": "art-w2nfgj-koqgxa6t",
  "description": "\"Mother&#x27;s Protection\"\nA dangerous world made safe\n\nHigh resolution image, owning, etc...\n\nhttps://mjt.dev/art-w2nfgj-koqgxa6t\n\nLink in profile.\n\nThanks :)\n\n---IG---\n#abstractart #abstractdigital #abstractdigitalart #artobserved #artoftheday #artview #codeart #contemporaryart #contemporaryexpressionism #dark #darkart #darkartwork #darksurrealism #distortionart #elephant #elephantart #fineart #love #loved #mom #momart #newaesthetic #newmediaart #nft #protected #safe #techspressionism #thecreatart #unitedbyedit #visualfodder\n\n---ArtStation---\n#abstract #art #artist #artoftheday #dart #digitalart #illustration #painting\n\n---Minds---\n#artcommunity #artist #artistsonminds #artth #artwork\n\n---Redbubble---\n#abstract #artist #expressionist #mjtdev\n\n"
}