{
  "backgroundColor": "rgb(233, 228, 225)",
  "textColor": "rgb(96, 96, 96)",
  "title": "Moment",
  "tagline": "Where were you then?",
  "notes": "\nLines and shadows.\n\nHow much of the beauty of the world do we miss by being so emersed in it?\n\nLike a fish unaware of water, I often forget to be flabbergasted that the world exists.\n\nIt is of course OK to forget this. Living and being part of the world is its own thing.\n\nBut it is nice from time to time to pluck a moment from time, and admire it for itself.\n\n\nProcess details: \n\nI'm using custom software I'm developing to produce these images.\n\nTypescript, and HTML canvas are my present foundational tools, my virtual equivalents of traditional brushes, pigment and surface.\n\nI sample from reference images and 'extract' different things from them (colors, shapes, textures, etc...).\n\nI then refine and recombine the 'extracts' looking for something that speaks to me.\n\nOften I'm programming at the same time, tweaking and adding new processing capabilities to the software.\n\nThe end result is a large SVG built up of several layers.\n\nEach layer serves a specific visual purpose, much like how one would do a traditional painting (underpainting, tone, line, etc..).\n\nThe final SVG is usually around 50-150mb in size.\n \nThe balance between programming and art I find pleases my soul.\n",
  "property": {
    "artist": "Matthew Joseph Taylor",
    "mediatype": "image/png",
    "year": 2021,
    "style": [
      "Abstract",
      "Expressionist"
    ]
  },
  "hashTag": {
    "IG": [
      "abstractart",
      "abstractart_daily",
      "abstractdigital",
      "abstractdigitalart",
      "abstractexpressionism",
      "archdrawing",
      "architecturesketch",
      "art_seeking",
      "artobserved",
      "artoftheday",
      "artseeking",
      "artview",
      "artwillsaveus",
      "cityscapeart",
      "codeart",
      "contemporaryart",
      "creativegrammer",
      "dailyabstract",
      "dailysketch",
      "deepart",
      "distortionart",
      "fineart",
      "instaart",
      "modernabstract",
      "nft",
      "sketchcollector",
      "theuniversalart",
      "unitedbyedit",
      "urbansketching",
      "visualfodder"
    ],
    "ArtStation": [
      "abstract",
      "art",
      "artist",
      "artoftheday",
      "dart",
      "digitalart",
      "illustration",
      "painting"
    ],
    "Minds": [
      "artist",
      "artistsonminds",
      "creativecommunity",
      "digitalart",
      "painting"
    ],
    "Redbubble": [
      "abstract",
      "artist",
      "expressionist",
      "mjtdev"
    ]
  },
  "action": [
    {
      "callToAction": "View on Instagram",
      "url": "https://www.instagram.com/mjtdev"
    },
    {
      "callToAction": "View on Minds",
      "url": "https://www.minds.com/mjtdev"
    },
    {
      "callToAction": "View on ArtStation",
      "url": "https://mjtdev.artstation.com"
    },
    {
      "callToAction": "Buy on Redbubble",
      "url": "https://www.redbubble.com/people/truepurpose/shop"
    },
    {
      "callToAction": "Own the NFT",
      "url": "https://opensea.io/collection/mjt-dev"
    }
  ],
  "artId": "art-aixeak-kq0gowcv",
  "description": "\"Moment\"\n\nWhere were you then?\n\n\nLines and shadows.\n\nHow much of the beauty of the world do we miss by being so emersed in it?\n\nLike a fish unaware of water, I often forget to be flabbergasted that the world exists.\n\nIt is of course OK to forget this. Living and being part of the world is its own thing.\n\nBut it is nice from time to time to pluck a moment from time, and admire it for itself.\n\n\nProcess details: \n\nI'm using custom software I'm developing to produce these images.\n\nTypescript, and HTML canvas are my present foundational tools, my virtual equivalents of traditional brushes, pigment and surface.\n\nI sample from reference images and 'extract' different things from them (colors, shapes, textures, etc...).\n\nI then refine and recombine the 'extracts' looking for something that speaks to me.\n\nOften I'm programming at the same time, tweaking and adding new processing capabilities to the software.\n\nThe end result is a large SVG built up of several layers.\n\nEach layer serves a specific visual purpose, much like how one would do a traditional painting (underpainting, tone, line, etc..).\n\nThe final SVG is usually around 50-150mb in size.\n \nThe balance between programming and art I find pleases my soul.\n\n\nHigh resolution image on my website\n\nhttps://mjt.dev/art-aixeak-kq0gowcv\n\nLinks to more of my work in my profile\n\nThanks :)\n\n---IG---\n#abstractart #abstractart_daily #abstractdigital #abstractdigitalart #abstractexpressionism #archdrawing #architecturesketch #art_seeking #artobserved #artoftheday #artseeking #artview #artwillsaveus #cityscapeart #codeart #contemporaryart #creativegrammer #dailyabstract #dailysketch #deepart #distortionart #fineart #instaart #modernabstract #nft #sketchcollector #theuniversalart #unitedbyedit #urbansketching #visualfodder\n\n---ArtStation---\n#abstract #art #artist #artoftheday #dart #digitalart #illustration #painting\n\n---Minds---\n#artist #artistsonminds #creativecommunity #digitalart #painting\n\n---Redbubble---\n#abstract #artist #expressionist #mjtdev\n\n"
}