{
  "backgroundColor": "rgb(128, 128, 128)",
  "textColor": "rgb(21, 21, 21)",
  "title": "Crescent Sun",
  "tagline": "Nothing lasts forever",
  "property": {
    "artist": "Matthew Joseph Taylor",
    "mediatype": "image/png",
    "year": 2021,
    "style": [
      "Abstract",
      "Expressionist"
    ]
  },
  "hashTag": {
    "IG": [
      "abstractart",
      "abstractart_daily",
      "abstractdigitalart",
      "abstractexpressionism",
      "artobserved",
      "artoftheday",
      "arttherapy",
      "artwillsaveus",
      "codeart",
      "contemporaryart",
      "contemporaryexpressionism",
      "creativegrammer",
      "dailyabstract",
      "dark",
      "darkart",
      "darksurrealism",
      "digitalart",
      "digitalpainters",
      "distortionart",
      "figurepainting",
      "fineart",
      "generativeart",
      "instaart",
      "modernabstract",
      "newaesthetic",
      "newmediaart",
      "nft",
      "theuniversalart",
      "unitedbyedit",
      "visualfodder"
    ],
    "ArtStation": [
      "abstract",
      "art",
      "artist",
      "artoftheday",
      "dart",
      "digitalart",
      "illustration",
      "painting"
    ],
    "Minds": [
      "art",
      "artfinder",
      "artwork",
      "creativecommunity",
      "digitalart"
    ],
    "Redbubble": [
      "abstract",
      "artist",
      "expressionist",
      "mjtdev"
    ]
  },
  "action": [
    {
      "callToAction": "View on Instagram",
      "url": "https://www.instagram.com/mjtdev"
    },
    {
      "callToAction": "View on Minds",
      "url": "https://www.minds.com/mjtdev"
    },
    {
      "callToAction": "View on ArtStation",
      "url": "https://mjtdev.artstation.com"
    },
    {
      "callToAction": "Buy on Redbubble",
      "url": "https://www.redbubble.com/people/truepurpose/shop"
    },
    {
      "callToAction": "Own the NFT",
      "url": "https://opensea.io/collection/mjt-dev"
    }
  ],
  "artId": "art-5cqyxn-kphuctml",
  "description": "\"Crescent Sun\"\n\nNothing lasts forever\n\n\n\nHigh resolution image on my website\n\nhttps://mjt.dev/art-5cqyxn-kphuctml\n\nLinks to more of my work in my profile\n\nThanks :)\n\n---IG---\n#abstractart #abstractart_daily #abstractdigitalart #abstractexpressionism #artobserved #artoftheday #arttherapy #artwillsaveus #codeart #contemporaryart #contemporaryexpressionism #creativegrammer #dailyabstract #dark #darkart #darksurrealism #digitalart #digitalpainters #distortionart #figurepainting #fineart #generativeart #instaart #modernabstract #newaesthetic #newmediaart #nft #theuniversalart #unitedbyedit #visualfodder\n\n---ArtStation---\n#abstract #art #artist #artoftheday #dart #digitalart #illustration #painting\n\n---Minds---\n#art #artfinder #artwork #creativecommunity #digitalart\n\n---Redbubble---\n#abstract #artist #expressionist #mjtdev\n\n"
}