{
  "backgroundColor": "rgb(128, 128, 128)",
  "textColor": "rgb(21, 21, 21)",
  "title": "Well Worn",
  "tagline": "A familiar place",
  "property": {
    "artist": "Matthew Joseph Taylor",
    "mediatype": "image/png",
    "year": 2021,
    "style": [
      "Abstract",
      "Expressionist"
    ]
  },
  "hashTag": {
    "IG": [
      "abstractart",
      "abstractart_daily",
      "abstractdigital",
      "abstractdigitalart",
      "amazingabstracts",
      "archdrawing",
      "artobserved",
      "artview",
      "artwillsaveus",
      "buildingsketch",
      "citydrawing",
      "contemporaryart",
      "creativegrammer",
      "dailyabstract",
      "dailysketch",
      "deepart",
      "figurepainting",
      "fineart",
      "fineliner",
      "generativeart",
      "houseportrait",
      "housesketch",
      "instaart",
      "newaesthetic",
      "newmediaart",
      "nft",
      "techspressionism",
      "theuniversalart",
      "unitedbyedit",
      "urbansketch"
    ],
    "ArtStation": [
      "abstract",
      "art",
      "artist",
      "artoftheday",
      "dart",
      "digitalart",
      "illustration",
      "painting"
    ],
    "Minds": [
      "art",
      "artcommunity",
      "artfinder",
      "digitalart",
      "myart"
    ],
    "Redbubble": [
      "abstract",
      "artist",
      "expressionist",
      "mjtdev"
    ]
  },
  "action": [
    {
      "callToAction": "View on Instagram",
      "url": "https://www.instagram.com/mjtdev"
    },
    {
      "callToAction": "View on Minds",
      "url": "https://www.minds.com/mjtdev"
    },
    {
      "callToAction": "View on ArtStation",
      "url": "https://mjtdev.artstation.com"
    },
    {
      "callToAction": "Buy on Redbubble",
      "url": "https://www.redbubble.com/people/truepurpose/shop"
    },
    {
      "callToAction": "Own the NFT",
      "url": "https://opensea.io/collection/mjt-dev"
    }
  ],
  "artId": "art-1tkdsiy-kpoj41ib",
  "description": "\"Well Worn\"\n\nA familiar place\n\n\n\nHigh resolution image on my website\n\nhttps://mjt.dev/art-1tkdsiy-kpoj41ib\n\nLinks to more of my work in my profile\n\nThanks :)\n\n---IG---\n#abstractart #abstractart_daily #abstractdigital #abstractdigitalart #amazingabstracts #archdrawing #artobserved #artview #artwillsaveus #buildingsketch #citydrawing #contemporaryart #creativegrammer #dailyabstract #dailysketch #deepart #figurepainting #fineart #fineliner #generativeart #houseportrait #housesketch #instaart #newaesthetic #newmediaart #nft #techspressionism #theuniversalart #unitedbyedit #urbansketch\n\n---ArtStation---\n#abstract #art #artist #artoftheday #dart #digitalart #illustration #painting\n\n---Minds---\n#art #artcommunity #artfinder #digitalart #myart\n\n---Redbubble---\n#abstract #artist #expressionist #mjtdev\n\n"
}