{
  "backgroundColor": "rgb(234, 234, 234)",
  "textColor": "rgb(96, 96, 96)",
  "title": "Patiently Waiting",
  "tagline": "Sometimes the thing to do is nothing",
  "property": {
    "artist": "Matthew Joseph Taylor",
    "mediatype": "image/png",
    "year": 2021,
    "style": [
      "Abstract",
      "Expressionist"
    ]
  },
  "hashTag": {
    "IG": [
      "abstractart",
      "abstractdigitalart",
      "amazingabstracts",
      "artoftheday",
      "arttherapy",
      "artwillsaveus",
      "codeart",
      "contemporaryart",
      "contemporaryexpressionism",
      "dailyabstract",
      "dark",
      "darkart",
      "darkartwork",
      "darksurrealism",
      "deepart",
      "digitalart",
      "digitalpainters",
      "face",
      "figurativeartist",
      "figurativeartists",
      "figurepainting",
      "fineart",
      "head",
      "mastersofdarkart",
      "modernabstract",
      "newaesthetic",
      "newmediaart",
      "thecreatart",
      "theuniversalart",
      "visualfodder"
    ],
    "ArtStation": [
      "abstract",
      "art",
      "artist",
      "artoftheday",
      "dart",
      "digitalart",
      "illustration",
      "painting"
    ],
    "Minds": [
      "artist",
      "creativecommunity",
      "digitalart",
      "myart",
      "painting"
    ],
    "Redbubble": [
      "abstract",
      "artist",
      "expressionist",
      "mjtdev"
    ]
  },
  "action": [
    {
      "callToAction": "View on Instagram",
      "url": "https://www.instagram.com/mjtdev"
    },
    {
      "callToAction": "View on Minds",
      "url": "https://www.minds.com/mjtdev"
    },
    {
      "callToAction": "View on ArtStation",
      "url": "https://mjtdev.artstation.com"
    },
    {
      "callToAction": "Buy on Redbubble",
      "url": "https://www.redbubble.com/people/truepurpose/shop"
    },
    {
      "callToAction": "Own the NFT",
      "url": "https://opensea.io/collection/mjt-dev"
    }
  ],
  "artId": "art-1qd9oa9-kpnyogfu",
  "description": "\"Patiently Waiting\"\n\nSometimes the thing to do is nothing\n\n\n\nHigh resolution image on my website\n\nhttps://mjt.dev/art-1qd9oa9-kpnyogfu\n\nLinks to more of my work in my profile\n\nThanks :)\n\n---IG---\n#abstractart #abstractdigitalart #amazingabstracts #artoftheday #arttherapy #artwillsaveus #codeart #contemporaryart #contemporaryexpressionism #dailyabstract #dark #darkart #darkartwork #darksurrealism #deepart #digitalart #digitalpainters #face #figurativeartist #figurativeartists #figurepainting #fineart #head #mastersofdarkart #modernabstract #newaesthetic #newmediaart #thecreatart #theuniversalart #visualfodder\n\n---ArtStation---\n#abstract #art #artist #artoftheday #dart #digitalart #illustration #painting\n\n---Minds---\n#artist #creativecommunity #digitalart #myart #painting\n\n---Redbubble---\n#abstract #artist #expressionist #mjtdev\n\n"
}