{
  "backgroundColor": "rgb(128, 128, 128)",
  "textColor": "rgb(21, 21, 21)",
  "title": "Needful Spirit",
  "tagline": "Do I own it, or does it own me?",
  "property": {
    "artist": "Matthew Joseph Taylor",
    "mediatype": "image/png",
    "year": 2021,
    "style": [
      "Abstract",
      "Expressionist"
    ]
  },
  "hashTag": {
    "IG": [
      "abstractart",
      "abstractdigital",
      "abstractdigitalart",
      "abstractexpressionism",
      "artobserved",
      "artoftheday",
      "artview",
      "attachment",
      "codeart",
      "contemporaryart",
      "contemporaryexpressionism",
      "dark",
      "darkart",
      "darksurrealism",
      "deepart",
      "digitalpainters",
      "distortionart",
      "figurativeabstract",
      "figurativeartist",
      "figurativeartists",
      "fineart",
      "ghost",
      "needy",
      "newaesthetic",
      "red",
      "techspressionism",
      "thecreatart",
      "theuniversalart",
      "unitedbyedit",
      "visualfodder"
    ],
    "ArtStation": [
      "abstract",
      "art",
      "artist",
      "artoftheday",
      "dart",
      "digitalart",
      "illustration",
      "painting"
    ],
    "Minds": [
      "artcommunity",
      "artfinder",
      "artth",
      "creativecommunity",
      "painting"
    ],
    "Redbubble": [
      "abstract",
      "artist",
      "expressionist",
      "mjtdev"
    ]
  },
  "action": [
    {
      "callToAction": "View on Instagram",
      "url": "https://www.instagram.com/mjtdev"
    },
    {
      "callToAction": "View on Minds",
      "url": "https://www.minds.com/mjtdev"
    },
    {
      "callToAction": "View on ArtStation",
      "url": "https://mjtdev.artstation.com"
    },
    {
      "callToAction": "Buy on Redbubble",
      "url": "https://www.redbubble.com/people/truepurpose/shop"
    },
    {
      "callToAction": "Own the NFT",
      "url": "https://opensea.io/collection/mjt-dev"
    }
  ],
  "artId": "art-g5roj2-koasdaxj",
  "description": "\"Needful Spirit\"\nDo I own it, or does it own me?\n\nHigh resolution image, owning, etc...\n\nhttps://mjt.dev/art-g5roj2-koasdaxj\n\nLink in profile.\n\nThanks :)\n\n---IG---\n#abstractart #abstractdigital #abstractdigitalart #abstractexpressionism #artobserved #artoftheday #artview #attachment #codeart #contemporaryart #contemporaryexpressionism #dark #darkart #darksurrealism #deepart #digitalpainters #distortionart #figurativeabstract #figurativeartist #figurativeartists #fineart #ghost #needy #newaesthetic #red #techspressionism #thecreatart #theuniversalart #unitedbyedit #visualfodder\n\n---ArtStation---\n#abstract #art #artist #artoftheday #dart #digitalart #illustration #painting\n\n---Minds---\n#artcommunity #artfinder #artth #creativecommunity #painting\n\n---Redbubble---\n#abstract #artist #expressionist #mjtdev\n\n"
}