{
  "backgroundColor": "rgb(234, 234, 234)",
  "textColor": "rgb(96, 96, 96)",
  "title": "Enjoy The Moment",
  "tagline": "It is such a lovely day",
  "notes": "\nI think I'm capturing many of the qualities of watercolor that I admire in this piece.\n\nEspecially the greys.\n\nRecommend focusing on the the solidness of the windows when viewing.\n\nAsk what is behind that window?\n\n\nProcess details: \n\nI'm using custom software I'm developing to produce these images.\n\nTypescript, and HTML canvas are my present foundational tools, my virtual equivalents of traditional brushes, pigment and surface.\n\nI sample from reference images and 'extract' different things from them (colors, shapes, textures, etc...).\n\nI then refine and recombine the 'extracts' looking for something that speaks to me.\n\nOften I'm programming at the same time, tweaking and adding new processing capabilities to the software.\n\nThe end result is a large SVG built up of several layers.\n\nEach layer serves a specific visual purpose, much like how one would do a traditional painting (underpainting, tone, line, etc..).\n\nThe final SVG is usually around 50-150mb in size.\n \nThe balance between programming and art I find pleases my soul.\n",
  "property": {
    "artist": "Matthew Joseph Taylor",
    "mediatype": "image/png",
    "year": 2021,
    "style": [
      "Abstract",
      "Expressionist"
    ]
  },
  "hashTag": {
    "IG": [
      "abstractdigital",
      "abstractexpressionism",
      "archdrawing",
      "architecturesketch",
      "art_seeking",
      "artforthesoul",
      "artoftheday",
      "arttherapy",
      "artview",
      "artwillsaveus",
      "citydrawing",
      "cityscapeart",
      "contemporaryart",
      "contemporaryexpressionism",
      "dailyabstract",
      "dailyarts",
      "deepart",
      "digitalpainters",
      "figurepainting",
      "generativeart",
      "houseportrait",
      "housesketch",
      "illustration",
      "newaesthetic",
      "newmediaart",
      "proceduralart",
      "urbansketch",
      "urbansketcher",
      "viewartgallery",
      "visualfodder"
    ],
    "ArtStation": [
      "abstract",
      "art",
      "artist",
      "artoftheday",
      "dart",
      "digitalart",
      "illustration",
      "painting"
    ],
    "Minds": [
      "artfinder",
      "artist",
      "creativecommunity",
      "digitalart",
      "painting"
    ],
    "Redbubble": [
      "abstract",
      "artist",
      "expressionist",
      "mjtdev"
    ]
  },
  "action": [
    {
      "callToAction": "View on Instagram",
      "url": "https://www.instagram.com/mjtdev"
    },
    {
      "callToAction": "View on Minds",
      "url": "https://www.minds.com/mjtdev"
    },
    {
      "callToAction": "View on ArtStation",
      "url": "https://mjtdev.artstation.com"
    },
    {
      "callToAction": "Buy on Redbubble",
      "url": "https://www.redbubble.com/people/truepurpose/shop"
    },
    {
      "callToAction": "Own the NFT",
      "url": "https://opensea.io/collection/mjt-dev"
    }
  ],
  "artId": "art-1vqrumo-kq6twyc9",
  "description": "\"Enjoy The Moment\"\n\nIt is such a lovely day\n\n\nI think I'm capturing many of the qualities of watercolor that I admire in this piece.\n\nEspecially the greys.\n\nRecommend focusing on the the solidness of the windows when viewing.\n\nAsk what is behind that window?\n\n\nProcess details: \n\nI'm using custom software I'm developing to produce these images.\n\nTypescript, and HTML canvas are my present foundational tools, my virtual equivalents of traditional brushes, pigment and surface.\n\nI sample from reference images and 'extract' different things from them (colors, shapes, textures, etc...).\n\nI then refine and recombine the 'extracts' looking for something that speaks to me.\n\nOften I'm programming at the same time, tweaking and adding new processing capabilities to the software.\n\nThe end result is a large SVG built up of several layers.\n\nEach layer serves a specific visual purpose, much like how one would do a traditional painting (underpainting, tone, line, etc..).\n\nThe final SVG is usually around 50-150mb in size.\n \nThe balance between programming and art I find pleases my soul.\n\n\nHigh resolution image on my website\n\nhttps://mjt.dev/art-1vqrumo-kq6twyc9\n\nLinks to more of my work in my profile\n\nThanks :)\n\n---IG---\n#abstractdigital #abstractexpressionism #archdrawing #architecturesketch #art_seeking #artforthesoul #artoftheday #arttherapy #artview #artwillsaveus #citydrawing #cityscapeart #contemporaryart #contemporaryexpressionism #dailyabstract #dailyarts #deepart #digitalpainters #figurepainting #generativeart #houseportrait #housesketch #illustration #newaesthetic #newmediaart #proceduralart #urbansketch #urbansketcher #viewartgallery #visualfodder\n\n---ArtStation---\n#abstract #art #artist #artoftheday #dart #digitalart #illustration #painting\n\n---Minds---\n#artfinder #artist #creativecommunity #digitalart #painting\n\n---Redbubble---\n#abstract #artist #expressionist #mjtdev\n\n"
}