{
  "backgroundColor": "rgb(231, 230, 231)",
  "textColor": "rgb(96, 96, 96)",
  "title": "Auto Rail",
  "tagline": "Tireless moving",
  "notes": "\nI love the beauty of strong lines over simple colors.\n\nThis piece has an almost \"line and pastel\" feel to my eyes.\n\nProcess details: \n\nThis is a large SVG built up of several layers, much like how one would do a traditional painting.\n\nThe final SVGs are usually around 50-150mb in size.\n \nWith each piece I hone the software I'm crafting to produce the images.\n \nThe balance between programming and art I find pleases my soul.\n",
  "property": {
    "artist": "Matthew Joseph Taylor",
    "mediatype": "image/png",
    "year": 2021,
    "style": [
      "Abstract",
      "Expressionist"
    ]
  },
  "hashTag": {
    "IG": [
      "abstractart_daily",
      "abstractdigitalart",
      "arch_more",
      "architecturesketch",
      "artoftheday",
      "arttherapy",
      "artwillsaveus",
      "contemporaryart",
      "contemporaryexpressionism",
      "dark",
      "darkart",
      "darkartwork",
      "digitalart",
      "digitalpainters",
      "distortionart",
      "figurepainting",
      "generativeart",
      "houseportrait",
      "housesketch",
      "illustration",
      "instaart",
      "mastersofdarkart",
      "modernabstract",
      "newaesthetic",
      "nft",
      "unitedbyedit",
      "urbansketch",
      "urbansketcher",
      "urbansketching",
      "visualfodder"
    ],
    "ArtStation": [
      "abstract",
      "art",
      "artist",
      "artoftheday",
      "dart",
      "digitalart",
      "illustration",
      "painting"
    ],
    "Minds": [
      "art",
      "artfinder",
      "artistsonminds",
      "digitalart",
      "painting"
    ],
    "Redbubble": [
      "abstract",
      "artist",
      "expressionist",
      "mjtdev"
    ]
  },
  "action": [
    {
      "callToAction": "View on Instagram",
      "url": "https://www.instagram.com/mjtdev"
    },
    {
      "callToAction": "View on Minds",
      "url": "https://www.minds.com/mjtdev"
    },
    {
      "callToAction": "View on ArtStation",
      "url": "https://mjtdev.artstation.com"
    },
    {
      "callToAction": "Buy on Redbubble",
      "url": "https://www.redbubble.com/people/truepurpose/shop"
    },
    {
      "callToAction": "Own the NFT",
      "url": "https://opensea.io/collection/mjt-dev"
    }
  ],
  "artId": "art-rkag74-kpvdonrw",
  "description": "\"Auto Rail\"\n\nTireless moving\n\n\nI love the beauty of strong lines over simple colors.\n\nThis piece has an almost &quot;line and pastel&quot; feel to my eyes.\n\nProcess details: \n\nThis is a large SVG built up of several layers, much like how one would do a traditional painting.\n\nThe final SVGs are usually around 50-150mb in size.\n \nWith each piece I hone the software I&#x27;m crafting to produce the images.\n \nThe balance between programming and art I find pleases my soul.\n\n\nHigh resolution image on my website\n\nhttps://mjt.dev/art-rkag74-kpvdonrw\n\nLinks to more of my work in my profile\n\nThanks :)\n\n---IG---\n#abstractart_daily #abstractdigitalart #arch_more #architecturesketch #artoftheday #arttherapy #artwillsaveus #contemporaryart #contemporaryexpressionism #dark #darkart #darkartwork #digitalart #digitalpainters #distortionart #figurepainting #generativeart #houseportrait #housesketch #illustration #instaart #mastersofdarkart #modernabstract #newaesthetic #nft #unitedbyedit #urbansketch #urbansketcher #urbansketching #visualfodder\n\n---ArtStation---\n#abstract #art #artist #artoftheday #dart #digitalart #illustration #painting\n\n---Minds---\n#art #artfinder #artistsonminds #digitalart #painting\n\n---Redbubble---\n#abstract #artist #expressionist #mjtdev\n\n"
}