{
  "backgroundColor": "rgb(128, 128, 128)",
  "textColor": "rgb(21, 21, 21)",
  "title": "Dark Nature",
  "tagline": "For there to be light, there must be dark",
  "property": {
    "artist": "Matthew Joseph Taylor",
    "mediatype": "image/png",
    "year": 2021,
    "style": [
      "Abstract",
      "Expressionist"
    ]
  },
  "hashTag": {
    "IG": [
      "abstractart",
      "abstractart_daily",
      "abstractdigital",
      "abstractexpressionism",
      "amazingabstracts",
      "artobserved",
      "artoftheday",
      "artview",
      "contemporaryart",
      "contemporaryexpressionism",
      "creativegrammer",
      "dailyabstract",
      "darkartwork",
      "darksurrealism",
      "deepart",
      "digitalart",
      "digitalpainters",
      "face",
      "figurativeabstract",
      "figurativeartists",
      "figurepainting",
      "fineart",
      "generativeart",
      "head",
      "modernabstract",
      "newaesthetic",
      "newmediaart",
      "techspressionism",
      "unitedbyedit"
    ],
    "ArtStation": [
      "abstract",
      "art",
      "artist",
      "artoftheday",
      "dart",
      "digitalart",
      "illustration",
      "painting"
    ],
    "Minds": [
      "artist",
      "artistsonminds",
      "artwork",
      "digitalart",
      "myart"
    ],
    "Redbubble": [
      "abstract",
      "artist",
      "expressionist",
      "mjtdev"
    ]
  },
  "action": [
    {
      "callToAction": "View on Instagram",
      "url": "https://www.instagram.com/mjtdev"
    },
    {
      "callToAction": "View on Minds",
      "url": "https://www.minds.com/mjtdev"
    },
    {
      "callToAction": "View on ArtStation",
      "url": "https://mjtdev.artstation.com"
    },
    {
      "callToAction": "Buy on Redbubble",
      "url": "https://www.redbubble.com/people/truepurpose/shop"
    },
    {
      "callToAction": "Own the NFT",
      "url": "https://opensea.io/collection/mjt-dev"
    }
  ],
  "artId": "art-1rbxug7-kpevelvj",
  "description": "\"Dark Nature\"\n\nFor there to be light, there must be dark\n\n\n\nHigh resolution image on my website\n\nhttps://mjt.dev/art-1rbxug7-kpevelvj\n\nLinks to more of my work in my profile\n\nThanks :)\n\n---IG---\n#abstractart #abstractart_daily #abstractdigital #abstractexpressionism #amazingabstracts #artobserved #artoftheday #artview #contemporaryart #contemporaryexpressionism #creativegrammer #dailyabstract #darkartwork #darksurrealism #deepart #digitalart #digitalpainters #face #figurativeabstract #figurativeartists #figurepainting #fineart #generativeart #head #modernabstract #newaesthetic #newmediaart #techspressionism #unitedbyedit\n\n---ArtStation---\n#abstract #art #artist #artoftheday #dart #digitalart #illustration #painting\n\n---Minds---\n#artist #artistsonminds #artwork #digitalart #myart\n\n---Redbubble---\n#abstract #artist #expressionist #mjtdev\n\n"
}