{
  "backgroundColor": "rgb(128, 128, 128)",
  "textColor": "rgb(21, 21, 21)",
  "title": "Open Opportunity",
  "tagline": "The world is what one makes of it",
  "property": {
    "artist": "Matthew Joseph Taylor",
    "mediatype": "image/png",
    "year": 2021,
    "style": [
      "Abstract",
      "Expressionist"
    ]
  },
  "hashTag": {
    "IG": [
      "abstractart",
      "abstractdigitalart",
      "artobserved",
      "artoftheday",
      "arttherapy",
      "codeart",
      "contemporaryart",
      "dailyabstract",
      "dark",
      "darkart",
      "darkartwork",
      "darksurrealism",
      "digitalart",
      "digitalpainters",
      "distortionart",
      "face",
      "figurativeabstract",
      "figurativeartist",
      "figurativeartists",
      "figurepainting",
      "fineart",
      "generativeart",
      "head",
      "instaart",
      "modernabstract",
      "newaesthetic",
      "newmediaart",
      "techspressionism",
      "theuniversalart",
      "visualfodder"
    ],
    "ArtStation": [
      "abstract",
      "art",
      "artist",
      "artoftheday",
      "dart",
      "digitalart",
      "illustration",
      "painting"
    ],
    "Minds": [
      "art",
      "artfinderapril",
      "artistsonminds",
      "artwork",
      "digitalart"
    ],
    "Redbubble": [
      "abstract",
      "artist",
      "expressionist",
      "mjtdev"
    ]
  },
  "action": [
    {
      "callToAction": "View on Instagram",
      "url": "https://www.instagram.com/mjtdev"
    },
    {
      "callToAction": "View on Minds",
      "url": "https://www.minds.com/mjtdev"
    },
    {
      "callToAction": "View on ArtStation",
      "url": "https://mjtdev.artstation.com"
    },
    {
      "callToAction": "Buy on Redbubble",
      "url": "https://www.redbubble.com/people/truepurpose/shop"
    },
    {
      "callToAction": "Own the NFT",
      "url": "https://opensea.io/collection/mjt-dev"
    }
  ],
  "artId": "art-1mcskcs-koxp4wod",
  "description": "\"Open Opportunity\"\nThe world is what one makes of it\n\nHigh resolution image, owning, etc...\n\nhttps://mjt.dev/art-1mcskcs-koxp4wod\n\nLink in profile.\n\nThanks :)\n\n---IG---\n#abstractart #abstractdigitalart #artobserved #artoftheday #arttherapy #codeart #contemporaryart #dailyabstract #dark #darkart #darkartwork #darksurrealism #digitalart #digitalpainters #distortionart #face #figurativeabstract #figurativeartist #figurativeartists #figurepainting #fineart #generativeart #head #instaart #modernabstract #newaesthetic #newmediaart #techspressionism #theuniversalart #visualfodder\n\n---ArtStation---\n#abstract #art #artist #artoftheday #dart #digitalart #illustration #painting\n\n---Minds---\n#art #artfinderapril #artistsonminds #artwork #digitalart\n\n---Redbubble---\n#abstract #artist #expressionist #mjtdev\n\n"
}