{
  "backgroundColor": "rgb(128, 128, 128)",
  "textColor": "rgb(21, 21, 21)",
  "title": "Looking Outwards",
  "tagline": "It is out there, calling...",
  "property": {
    "artist": "Matthew Joseph Taylor",
    "mediatype": "image/png",
    "year": 2021,
    "style": [
      "Abstract",
      "Expressionist"
    ]
  },
  "hashTag": {
    "IG": [
      "abstractart",
      "abstractdigital",
      "abstractdigitalart",
      "abstractexpressionism",
      "artobserved",
      "artoftheday",
      "artview",
      "cat",
      "catart",
      "catportraits",
      "codeart",
      "contemporaryart",
      "contemporaryexpressionism",
      "deepart",
      "digitalart",
      "digitalpainters",
      "distortionart",
      "feline",
      "fineart",
      "longing",
      "newaesthetic",
      "newmediaart",
      "nft",
      "techspressionism",
      "theuniversalart",
      "thinking",
      "unitedbyedit",
      "visualfodder",
      "waiting",
      "watchful"
    ],
    "ArtStation": [
      "abstract",
      "art",
      "artist",
      "artoftheday",
      "dart",
      "digitalart",
      "illustration",
      "painting"
    ],
    "Minds": [
      "art",
      "artcommunity",
      "artth",
      "myart",
      "painting"
    ],
    "Redbubble": [
      "abstract",
      "artist",
      "expressionist",
      "mjtdev"
    ]
  },
  "action": [
    {
      "callToAction": "View on Instagram",
      "url": "https://www.instagram.com/mjtdev"
    },
    {
      "callToAction": "View on Minds",
      "url": "https://www.minds.com/mjtdev"
    },
    {
      "callToAction": "View on ArtStation",
      "url": "https://mjtdev.artstation.com"
    },
    {
      "callToAction": "Buy on Redbubble",
      "url": "https://www.redbubble.com/people/truepurpose/shop"
    },
    {
      "callToAction": "Own the NFT",
      "url": "https://opensea.io/collection/mjt-dev"
    }
  ],
  "artId": "art-1jrdhed-kof2fw1x",
  "description": "\"Looking Outwards\"\nIt is out there, calling...\n\nHigh resolution image, owning, etc...\n\nhttps://mjt.dev/art-1jrdhed-kof2fw1x\n\nLink in profile.\n\nThanks :)\n\n---IG---\n#abstractart #abstractdigital #abstractdigitalart #abstractexpressionism #artobserved #artoftheday #artview #cat #catart #catportraits #codeart #contemporaryart #contemporaryexpressionism #deepart #digitalart #digitalpainters #distortionart #feline #fineart #longing #newaesthetic #newmediaart #nft #techspressionism #theuniversalart #thinking #unitedbyedit #visualfodder #waiting #watchful\n\n---ArtStation---\n#abstract #art #artist #artoftheday #dart #digitalart #illustration #painting\n\n---Minds---\n#art #artcommunity #artth #myart #painting\n\n---Redbubble---\n#abstract #artist #expressionist #mjtdev\n\n"
}