{
  "backgroundColor": "rgb(128, 128, 128)",
  "textColor": "rgb(21, 21, 21)",
  "title": "The Art of Wearing",
  "tagline": "Style is a survival skill",
  "property": {
    "artist": "Matthew Joseph Taylor",
    "mediatype": "image/png",
    "year": 2021,
    "style": [
      "Abstract",
      "Expressionist"
    ]
  },
  "hashTag": {
    "IG": [
      "abstractart",
      "abstractdigitalart",
      "abstractexpressionism",
      "artobserved",
      "artview",
      "blackdress",
      "codeart",
      "contemporaryart",
      "contemporaryexpressionism",
      "dark",
      "darkart",
      "darksurrealism",
      "deepart",
      "digitalart",
      "digitalpainters",
      "distortionart",
      "dress",
      "fashion",
      "figurativeartist",
      "figurativeartists",
      "fineart",
      "newmediaart",
      "nft",
      "redgloves",
      "redshoes",
      "techspressionism",
      "thecreatart",
      "theuniversalart",
      "visualfodder",
      "vogue"
    ],
    "ArtStation": [
      "abstract",
      "art",
      "artist",
      "artoftheday",
      "dart",
      "digitalart",
      "illustration",
      "painting"
    ],
    "Minds": [
      "artcommunity",
      "artist",
      "artistsonminds",
      "digitalart",
      "painting"
    ],
    "Redbubble": [
      "abstract",
      "artist",
      "expressionist",
      "mjtdev"
    ]
  },
  "action": [
    {
      "callToAction": "View on Instagram",
      "url": "https://www.instagram.com/mjtdev"
    },
    {
      "callToAction": "View on Minds",
      "url": "https://www.minds.com/mjtdev"
    },
    {
      "callToAction": "View on ArtStation",
      "url": "https://mjtdev.artstation.com"
    },
    {
      "callToAction": "Buy on Redbubble",
      "url": "https://www.redbubble.com/people/truepurpose/shop"
    },
    {
      "callToAction": "Own the NFT",
      "url": "https://opensea.io/collection/mjt-dev"
    }
  ],
  "artId": "art-15t1zps-ko6jehqv",
  "description": "\"The Art of Wearing\"\nStyle is a survival skill\n\nHigh resolution image, owning, etc...\n\nhttps://mjt.dev/art-15t1zps-ko6jehqv\n\nLink in profile.\n\nThanks :)\n\n---IG---\n#abstractart #abstractdigitalart #abstractexpressionism #artobserved #artview #blackdress #codeart #contemporaryart #contemporaryexpressionism #dark #darkart #darksurrealism #deepart #digitalart #digitalpainters #distortionart #dress #fashion #figurativeartist #figurativeartists #fineart #newmediaart #nft #redgloves #redshoes #techspressionism #thecreatart #theuniversalart #visualfodder #vogue\n\n---ArtStation---\n#abstract #art #artist #artoftheday #dart #digitalart #illustration #painting\n\n---Minds---\n#artcommunity #artist #artistsonminds #digitalart #painting\n\n---Redbubble---\n#abstract #artist #expressionist #mjtdev\n\n"
}