{
  "backgroundColor": "rgb(128, 128, 128)",
  "textColor": "rgb(21, 21, 21)",
  "title": "Laughing Killer",
  "tagline": "Terrifying or cute? All depends on your size",
  "property": {
    "artist": "Matthew Joseph Taylor",
    "mediatype": "image/png",
    "year": 2021,
    "style": [
      "Abstract",
      "Expressionist"
    ]
  },
  "hashTag": {
    "IG": [
      "abstractart",
      "abstractdigital",
      "abstractdigitalart",
      "abstractexpressionism",
      "artobserved",
      "artoftheday",
      "artview",
      "cat",
      "catart",
      "catportraits",
      "codeart",
      "contemporaryart",
      "contemporaryexpressionism",
      "dark",
      "darkart",
      "darkartwork",
      "darksurrealism",
      "digitalart",
      "digitalpainters",
      "distortionart",
      "feline",
      "fineart",
      "laughing",
      "laughter",
      "newmediaart",
      "techspressionism",
      "terrifying",
      "theuniversalart",
      "unitedbyedit",
      "visualfodder"
    ],
    "ArtStation": [
      "abstract",
      "art",
      "artist",
      "artoftheday",
      "dart",
      "digitalart",
      "illustration",
      "painting"
    ],
    "Minds": [
      "artfinderapril",
      "artistsonminds",
      "artth",
      "artwork",
      "painting"
    ],
    "Redbubble": [
      "abstract",
      "artist",
      "expressionist",
      "mjtdev"
    ]
  },
  "action": [
    {
      "callToAction": "View on Instagram",
      "url": "https://www.instagram.com/mjtdev"
    },
    {
      "callToAction": "View on Minds",
      "url": "https://www.minds.com/mjtdev"
    },
    {
      "callToAction": "View on ArtStation",
      "url": "https://mjtdev.artstation.com"
    },
    {
      "callToAction": "Buy on Redbubble",
      "url": "https://www.redbubble.com/people/truepurpose/shop"
    },
    {
      "callToAction": "Own the NFT",
      "url": "https://opensea.io/collection/mjt-dev"
    }
  ],
  "artId": "art-9kpe51-kogf2dcx",
  "description": "\"Laughing Killer\"\nTerrifying or cute? All depends on your size\n\nHigh resolution image, owning, etc...\n\nhttps://mjt.dev/art-9kpe51-kogf2dcx\n\nLink in profile.\n\nThanks :)\n\n---IG---\n#abstractart #abstractdigital #abstractdigitalart #abstractexpressionism #artobserved #artoftheday #artview #cat #catart #catportraits #codeart #contemporaryart #contemporaryexpressionism #dark #darkart #darkartwork #darksurrealism #digitalart #digitalpainters #distortionart #feline #fineart #laughing #laughter #newmediaart #techspressionism #terrifying #theuniversalart #unitedbyedit #visualfodder\n\n---ArtStation---\n#abstract #art #artist #artoftheday #dart #digitalart #illustration #painting\n\n---Minds---\n#artfinderapril #artistsonminds #artth #artwork #painting\n\n---Redbubble---\n#abstract #artist #expressionist #mjtdev\n\n"
}