{
  "backgroundColor": "rgb(128, 128, 128)",
  "textColor": "rgb(21, 21, 21)",
  "title": "Fighter",
  "tagline": "There isn't an if, only what for",
  "property": {
    "artist": "Matthew Joseph Taylor",
    "mediatype": "image/png",
    "year": 2021,
    "style": [
      "Abstract",
      "Expressionist"
    ]
  },
  "hashTag": {
    "IG": [
      "abstractart",
      "abstractart_daily",
      "abstractdigitalart",
      "artobserved",
      "artoftheday",
      "arttherapy",
      "artview",
      "artwillsaveus",
      "codeart",
      "contemporaryart",
      "creativegrammer",
      "dailyabstract",
      "dark",
      "darksurrealism",
      "deepart",
      "digitalart",
      "digitalpainters",
      "figurativeabstract",
      "figurativeartist",
      "figurativeartists",
      "generativeart",
      "instaart",
      "mastersofdarkart",
      "newaesthetic",
      "newmediaart",
      "nft",
      "techspressionism",
      "theuniversalart",
      "unitedbyedit",
      "visualfodder"
    ],
    "ArtStation": [
      "abstract",
      "art",
      "artist",
      "artoftheday",
      "dart",
      "digitalart",
      "illustration",
      "painting"
    ],
    "Minds": [
      "art",
      "artfinder",
      "creativecommunity",
      "digitalart",
      "myart"
    ],
    "Redbubble": [
      "abstract",
      "artist",
      "expressionist",
      "mjtdev"
    ]
  },
  "action": [
    {
      "callToAction": "View on Instagram",
      "url": "https://www.instagram.com/mjtdev"
    },
    {
      "callToAction": "View on Minds",
      "url": "https://www.minds.com/mjtdev"
    },
    {
      "callToAction": "View on ArtStation",
      "url": "https://mjtdev.artstation.com"
    },
    {
      "callToAction": "Buy on Redbubble",
      "url": "https://www.redbubble.com/people/truepurpose/shop"
    },
    {
      "callToAction": "Own the NFT",
      "url": "https://opensea.io/collection/mjt-dev"
    }
  ],
  "artId": "art-di481n-kpm6jjzm",
  "description": "\"Fighter\"\n\nThere isn&#x27;t an if, only what for\n\n\n\nHigh resolution image on my website\n\nhttps://mjt.dev/art-di481n-kpm6jjzm\n\nLinks to more of my work in my profile\n\nThanks :)\n\n---IG---\n#abstractart #abstractart_daily #abstractdigitalart #artobserved #artoftheday #arttherapy #artview #artwillsaveus #codeart #contemporaryart #creativegrammer #dailyabstract #dark #darksurrealism #deepart #digitalart #digitalpainters #figurativeabstract #figurativeartist #figurativeartists #generativeart #instaart #mastersofdarkart #newaesthetic #newmediaart #nft #techspressionism #theuniversalart #unitedbyedit #visualfodder\n\n---ArtStation---\n#abstract #art #artist #artoftheday #dart #digitalart #illustration #painting\n\n---Minds---\n#art #artfinder #creativecommunity #digitalart #myart\n\n---Redbubble---\n#abstract #artist #expressionist #mjtdev\n\n"
}