{
  "backgroundColor": "rgb(106, 105, 108)",
  "textColor": "rgb(234, 234, 234)",
  "title": "Stroll to Adventure",
  "tagline": "Who knows what the next turn will bring?",
  "property": {
    "artist": "Matthew Joseph Taylor",
    "mediatype": "image/png",
    "year": 2021,
    "style": [
      "Abstract",
      "Expressionist"
    ]
  },
  "hashTag": {
    "IG": [
      "abstractart_daily",
      "abstractdigitalart",
      "abstractexpressionism",
      "amazingabstracts",
      "arch_more",
      "archdrawing",
      "arttherapy",
      "artview",
      "buildingsketch",
      "contemporaryart",
      "dailyabstract",
      "dailysketch",
      "deepart",
      "digitalpainters",
      "fineart",
      "fineliner",
      "houseportrait",
      "housesketch",
      "instaart",
      "modernabstract",
      "newmediaart",
      "nft",
      "sketchcollector",
      "techspressionism",
      "theuniversalart",
      "urbansketch",
      "urbansketcher",
      "urbansketching",
      "usk",
      "visualfodder"
    ],
    "ArtStation": [
      "abstract",
      "art",
      "artist",
      "artoftheday",
      "dart",
      "digitalart",
      "illustration",
      "painting"
    ],
    "Minds": [
      "art",
      "artistsonminds",
      "artwork",
      "creativecommunity",
      "myart"
    ],
    "Redbubble": [
      "abstract",
      "artist",
      "expressionist",
      "mjtdev"
    ]
  },
  "action": [
    {
      "callToAction": "View on Instagram",
      "url": "https://www.instagram.com/mjtdev"
    },
    {
      "callToAction": "View on Minds",
      "url": "https://www.minds.com/mjtdev"
    },
    {
      "callToAction": "View on ArtStation",
      "url": "https://mjtdev.artstation.com"
    },
    {
      "callToAction": "Buy on Redbubble",
      "url": "https://www.redbubble.com/people/truepurpose/shop"
    },
    {
      "callToAction": "Own the NFT",
      "url": "https://opensea.io/collection/mjt-dev"
    }
  ],
  "artId": "art-vw8887-kpqxjalq",
  "description": "\"Stroll to Adventure\"\n\nWho knows what the next turn will bring?\n\n\n\nHigh resolution image on my website\n\nhttps://mjt.dev/art-vw8887-kpqxjalq\n\nLinks to more of my work in my profile\n\nThanks :)\n\n---IG---\n#abstractart_daily #abstractdigitalart #abstractexpressionism #amazingabstracts #arch_more #archdrawing #arttherapy #artview #buildingsketch #contemporaryart #dailyabstract #dailysketch #deepart #digitalpainters #fineart #fineliner #houseportrait #housesketch #instaart #modernabstract #newmediaart #nft #sketchcollector #techspressionism #theuniversalart #urbansketch #urbansketcher #urbansketching #usk #visualfodder\n\n---ArtStation---\n#abstract #art #artist #artoftheday #dart #digitalart #illustration #painting\n\n---Minds---\n#art #artistsonminds #artwork #creativecommunity #myart\n\n---Redbubble---\n#abstract #artist #expressionist #mjtdev\n\n"
}