{
  "backgroundColor": "rgb(128, 128, 128)",
  "textColor": "rgb(21, 21, 21)",
  "title": "Tomorrow's Self",
  "tagline": "The future is unknown",
  "property": {
    "artist": "Matthew Joseph Taylor",
    "mediatype": "image/png",
    "year": 2021,
    "style": [
      "Abstract",
      "Expressionist"
    ]
  },
  "hashTag": {
    "IG": [
      "abstractart",
      "abstractart_daily",
      "abstractdigital",
      "abstractdigitalart",
      "abstractexpressionism",
      "artobserved",
      "artoftheday",
      "arttherapy",
      "codeart",
      "creativegrammer",
      "dark",
      "darkart",
      "darksurrealism",
      "digitalart",
      "distortionart",
      "face",
      "figurativeabstract",
      "figurativeartist",
      "fineart",
      "future",
      "head",
      "instaart",
      "mastersofdarkart",
      "modernabstract",
      "newaesthetic",
      "newmediaart",
      "nft",
      "techspressionism",
      "thecreatart",
      "visualfodder"
    ],
    "ArtStation": [
      "abstract",
      "art",
      "artist",
      "artoftheday",
      "dart",
      "digitalart",
      "illustration",
      "painting"
    ],
    "Minds": [
      "artist",
      "artwork",
      "creativecommunity",
      "digitalart",
      "myart"
    ],
    "Redbubble": [
      "abstract",
      "artist",
      "expressionist",
      "mjtdev"
    ]
  },
  "action": [
    {
      "callToAction": "View on Instagram",
      "url": "https://www.instagram.com/mjtdev"
    },
    {
      "callToAction": "View on Minds",
      "url": "https://www.minds.com/mjtdev"
    },
    {
      "callToAction": "View on ArtStation",
      "url": "https://mjtdev.artstation.com"
    },
    {
      "callToAction": "Buy on Redbubble",
      "url": "https://www.redbubble.com/people/truepurpose/shop"
    },
    {
      "callToAction": "Own the NFT",
      "url": "https://opensea.io/collection/mjt-dev"
    }
  ],
  "artId": "art-tmprl9-kpldske4",
  "description": "\"Tomorrow&#x27;s Self\"\n\nThe future is unknown\n\n\n\nHigh resolution image on my website\n\nhttps://mjt.dev/art-tmprl9-kpldske4\n\nLinks to more of my work in my profile\n\nThanks :)\n\n---IG---\n#abstractart #abstractart_daily #abstractdigital #abstractdigitalart #abstractexpressionism #artobserved #artoftheday #arttherapy #codeart #creativegrammer #dark #darkart #darksurrealism #digitalart #distortionart #face #figurativeabstract #figurativeartist #fineart #future #head #instaart #mastersofdarkart #modernabstract #newaesthetic #newmediaart #nft #techspressionism #thecreatart #visualfodder\n\n---ArtStation---\n#abstract #art #artist #artoftheday #dart #digitalart #illustration #painting\n\n---Minds---\n#artist #artwork #creativecommunity #digitalart #myart\n\n---Redbubble---\n#abstract #artist #expressionist #mjtdev\n\n"
}