{
  "backgroundColor": "rgb(233, 228, 225)",
  "textColor": "rgb(96, 96, 96)",
  "title": "Decisions",
  "tagline": "What would the world be without choice?",
  "notes": "\n\nI think there is a lot to be said in this style of art.\n\nPerhaps it is just the infatuation of the moment, but I'm starting to feel the groove of it.\n\nThat magical feeling when everthing one touches turns to gold. \n\nEvery move changes direction, but there don't seem be any wrong paths.\n\nI'm in that zone of loving the art I'm creating.\n\nI feel empowered by the feeling I have the ability to create art that I enjoy. \n\nProcess details: \n\nI'm using custom software I'm developing to produce these images.\n\nTypescript, and HTML canvas are my present foundational tools, my virtual equivalents of traditional brushes, pigment and surface.\n\nI sample from reference images and 'extract' different things from them (colors, shapes, textures, etc...).\n\nI then refine and recombine the 'extracts' looking for something that speaks to me.\n\nOften I'm programming at the same time, tweaking and adding new processing capabilities to the software.\n\nThe end result is a large SVG built up of several layers.\n\nEach layer serves a specific visual purpose, much like how one would do a traditional painting (underpainting, tone, line, etc..).\n\nThe final SVG is usually around 50-150mb in size.\n \nThe balance between programming and art I find pleases my soul.\n",
  "property": {
    "artist": "Matthew Joseph Taylor",
    "mediatype": "image/png",
    "year": 2021,
    "style": [
      "Abstract",
      "Expressionist"
    ]
  },
  "hashTag": {
    "IG": [
      "abstractart",
      "abstractart_daily",
      "abstractdigital",
      "abstractdigitalart",
      "amazingabstracts",
      "arch_more",
      "archdrawing",
      "artoftheday",
      "artseeking",
      "arttherapy",
      "artview",
      "cityscapeart",
      "contemporaryart",
      "contemporaryexpressionism",
      "creativegrammer",
      "dailysketch",
      "digitalart",
      "distortionart",
      "figurepainting",
      "fineart",
      "generativeart",
      "instaart",
      "modernabstract",
      "newaesthetic",
      "newmediaart",
      "nft",
      "proceduralart",
      "techspressionism",
      "theuniversalart",
      "visualfodder"
    ],
    "ArtStation": [
      "abstract",
      "art",
      "artist",
      "artoftheday",
      "dart",
      "digitalart",
      "illustration",
      "painting"
    ],
    "Minds": [
      "art",
      "artcommunity",
      "artfinder",
      "creativecommunity",
      "digitalart"
    ],
    "Redbubble": [
      "abstract",
      "artist",
      "expressionist",
      "mjtdev"
    ]
  },
  "action": [
    {
      "callToAction": "View on Instagram",
      "url": "https://www.instagram.com/mjtdev"
    },
    {
      "callToAction": "View on Minds",
      "url": "https://www.minds.com/mjtdev"
    },
    {
      "callToAction": "View on ArtStation",
      "url": "https://mjtdev.artstation.com"
    },
    {
      "callToAction": "Buy on Redbubble",
      "url": "https://www.redbubble.com/people/truepurpose/shop"
    },
    {
      "callToAction": "Own the NFT",
      "url": "https://opensea.io/collection/mjt-dev"
    }
  ],
  "artId": "art-f6e1ov-kq0k6mkb",
  "description": "\"Decisions\"\n\nWhat would the world be without choice?\n\n\n\nI think there is a lot to be said in this style of art.\n\nPerhaps it is just the infatuation of the moment, but I'm starting to feel the groove of it.\n\nThat magical feeling when everthing one touches turns to gold. \n\nEvery move changes direction, but there don't seem be any wrong paths.\n\nI'm in that zone of loving the art I'm creating.\n\nI feel empowered by the feeling I have the ability to create art that I enjoy. \n\nProcess details: \n\nI'm using custom software I'm developing to produce these images.\n\nTypescript, and HTML canvas are my present foundational tools, my virtual equivalents of traditional brushes, pigment and surface.\n\nI sample from reference images and 'extract' different things from them (colors, shapes, textures, etc...).\n\nI then refine and recombine the 'extracts' looking for something that speaks to me.\n\nOften I'm programming at the same time, tweaking and adding new processing capabilities to the software.\n\nThe end result is a large SVG built up of several layers.\n\nEach layer serves a specific visual purpose, much like how one would do a traditional painting (underpainting, tone, line, etc..).\n\nThe final SVG is usually around 50-150mb in size.\n \nThe balance between programming and art I find pleases my soul.\n\n\nHigh resolution image on my website\n\nhttps://mjt.dev/art-f6e1ov-kq0k6mkb\n\nLinks to more of my work in my profile\n\nThanks :)\n\n---IG---\n#abstractart #abstractart_daily #abstractdigital #abstractdigitalart #amazingabstracts #arch_more #archdrawing #artoftheday #artseeking #arttherapy #artview #cityscapeart #contemporaryart #contemporaryexpressionism #creativegrammer #dailysketch #digitalart #distortionart #figurepainting #fineart #generativeart #instaart #modernabstract #newaesthetic #newmediaart #nft #proceduralart #techspressionism #theuniversalart #visualfodder\n\n---ArtStation---\n#abstract #art #artist #artoftheday #dart #digitalart #illustration #painting\n\n---Minds---\n#art #artcommunity #artfinder #creativecommunity #digitalart\n\n---Redbubble---\n#abstract #artist #expressionist #mjtdev\n\n"
}