{
  "backgroundColor": "rgb(234, 234, 234)",
  "textColor": "rgb(96, 96, 96)",
  "title": "Seeking Salvation",
  "tagline": "We all fall down from time to time",
  "property": {
    "artist": "Matthew Joseph Taylor",
    "mediatype": "image/png",
    "year": 2021,
    "style": [
      "Abstract",
      "Expressionist"
    ]
  },
  "hashTag": {
    "IG": [
      "abstractartorg",
      "abstractdigitalart",
      "abstractexpressionism",
      "artobserved",
      "artview",
      "codeart",
      "contemporaryart",
      "dark",
      "darkart",
      "darkartwork",
      "deepart",
      "distortionart",
      "figurativeabstract",
      "figurativeartist",
      "figurativeartists",
      "fineart",
      "forgiveness",
      "mafia_editlove",
      "newmediaart",
      "nft",
      "redbubbleartists",
      "salvation",
      "scaryart",
      "spookyart",
      "techspressionism",
      "thecreatart",
      "theuniversalart",
      "unitedbyedit",
      "uplift",
      "visualfodder"
    ],
    "ArtStation": [
      "abstract",
      "art",
      "artist",
      "artoftheday",
      "dart",
      "digitalart",
      "illustration",
      "painting"
    ],
    "Minds": [
      "art",
      "artcommunity",
      "artfinder",
      "artfinderapril",
      "digitalart"
    ],
    "Redbubble": [
      "abstract",
      "artist",
      "expressionist",
      "mjtdev"
    ]
  },
  "action": [
    {
      "callToAction": "View on Instagram",
      "url": "https://www.instagram.com/mjtdev"
    },
    {
      "callToAction": "View on Minds",
      "url": "https://www.minds.com/mjtdev"
    },
    {
      "callToAction": "View on ArtStation",
      "url": "https://mjtdev.artstation.com"
    },
    {
      "callToAction": "Buy on Redbubble",
      "url": "https://www.redbubble.com/people/truepurpose/shop"
    },
    {
      "callToAction": "Own the NFT",
      "url": "https://opensea.io/collection/mjt-dev"
    }
  ],
  "artId": "art-e5vuix-knz3me72",
  "description": "\"Seeking Salvation\"\nWe all fall down from time to time\n\nHigh resolution image, owning, etc...\n\nhttps://mjt.dev/art-e5vuix-knz3me72\n\nLink in profile.\n\nThanks :)\n\n---IG---\n#abstractartorg #abstractdigitalart #abstractexpressionism #artobserved #artview #codeart #contemporaryart #dark #darkart #darkartwork #deepart #distortionart #figurativeabstract #figurativeartist #figurativeartists #fineart #forgiveness #mafia_editlove #newmediaart #nft #redbubbleartists #salvation #scaryart #spookyart #techspressionism #thecreatart #theuniversalart #unitedbyedit #uplift #visualfodder\n\n---ArtStation---\n#abstract #art #artist #artoftheday #dart #digitalart #illustration #painting\n\n---Minds---\n#art #artcommunity #artfinder #artfinderapril #digitalart\n\n---Redbubble---\n#abstract #artist #expressionist #mjtdev\n\n"
}