{
  "backgroundColor": "rgb(128, 128, 128)",
  "textColor": "rgb(21, 21, 21)",
  "title": "Hurling Metal",
  "tagline": "Give it everything, and then a little more",
  "property": {
    "artist": "Matthew Joseph Taylor",
    "mediatype": "image/png",
    "year": 2021,
    "style": [
      "Abstract",
      "Expressionist"
    ]
  },
  "hashTag": {
    "IG": [
      "abstractart_daily",
      "abstractdigital",
      "abstractdigitalart",
      "amazingabstracts",
      "artobserved",
      "artoftheday",
      "arttherapy",
      "artview",
      "artwillsaveus",
      "codeart",
      "contemporaryart",
      "contemporaryexpressionism",
      "creativegrammer",
      "dailyabstract",
      "digitalart",
      "distortionart",
      "fast",
      "figurepainting",
      "fineart",
      "fun",
      "instaart",
      "modernabstract",
      "newaesthetic",
      "newmediaart",
      "nft",
      "speed",
      "streetart",
      "techspressionism",
      "theuniversalart",
      "visualfodder"
    ],
    "ArtStation": [
      "abstract",
      "art",
      "artist",
      "artoftheday",
      "dart",
      "digitalart",
      "illustration",
      "painting"
    ],
    "Minds": [
      "artcommunity",
      "artist",
      "creativecommunity",
      "digitalart",
      "myart"
    ],
    "Redbubble": [
      "abstract",
      "artist",
      "expressionist",
      "mjtdev"
    ]
  },
  "action": [
    {
      "callToAction": "View on Instagram",
      "url": "https://www.instagram.com/mjtdev"
    },
    {
      "callToAction": "View on Minds",
      "url": "https://www.minds.com/mjtdev"
    },
    {
      "callToAction": "View on ArtStation",
      "url": "https://mjtdev.artstation.com"
    },
    {
      "callToAction": "Buy on Redbubble",
      "url": "https://www.redbubble.com/people/truepurpose/shop"
    },
    {
      "callToAction": "Own the NFT",
      "url": "https://opensea.io/collection/mjt-dev"
    }
  ],
  "artId": "art-j2lpt1-kpkh5scj",
  "description": "\"Hurling Metal\"\n\nGive it everything, and then a little more\n\n\n\nHigh resolution image on my website\n\nhttps://mjt.dev/art-j2lpt1-kpkh5scj\n\nLinks to more of my work in my profile\n\nThanks :)\n\n---IG---\n#abstractart_daily #abstractdigital #abstractdigitalart #amazingabstracts #artobserved #artoftheday #arttherapy #artview #artwillsaveus #codeart #contemporaryart #contemporaryexpressionism #creativegrammer #dailyabstract #digitalart #distortionart #fast #figurepainting #fineart #fun #instaart #modernabstract #newaesthetic #newmediaart #nft #speed #streetart #techspressionism #theuniversalart #visualfodder\n\n---ArtStation---\n#abstract #art #artist #artoftheday #dart #digitalart #illustration #painting\n\n---Minds---\n#artcommunity #artist #creativecommunity #digitalart #myart\n\n---Redbubble---\n#abstract #artist #expressionist #mjtdev\n\n"
}