{
  "backgroundColor": "rgb(234, 234, 234)",
  "textColor": "rgb(96, 96, 96)",
  "title": "Running on Empty",
  "tagline": "Demand every last drop",
  "notes": "\nWe all start somewhere, and climb as high as we can, as quickly as possible.\n\nTo struggle is to live. \n\nThose who struggle the most, I think in some deep sense live the most.\n\n\nProcess details: \n\nI'm using custom software I'm developing to produce these images.\n\nTypescript, and HTML canvas are my present foundational tools, my virtual equivalents of traditional brushes, pigment and surface.\n\nI sample from reference images and 'extract' different things from them (colors, shapes, textures, etc...).\n\nI then refine and recombine the 'extracts' looking for something that speaks to me.\n\nOften I'm programming at the same time, tweaking and adding new processing capabilities to the software.\n\nThe end result is a large SVG built up of several layers.\n\nEach layer serves a specific visual purpose, much like how one would do a traditional painting (underpainting, tone, line, etc..).\n\nThe final SVG is usually around 50-150mb in size.\n \nThe balance between programming and art I find pleases my soul.\n",
  "property": {
    "artist": "Matthew Joseph Taylor",
    "mediatype": "image/png",
    "year": 2021,
    "style": [
      "Abstract",
      "Expressionist"
    ]
  },
  "hashTag": {
    "IG": [
      "abstractart",
      "abstractdigitalart",
      "archdrawing",
      "artforthesoul",
      "artoftheday",
      "artseeking",
      "arttherapy",
      "buildingsketch",
      "citydrawing",
      "contemporaryart",
      "contemporaryexpressionism",
      "creativegrammer",
      "dailyarts",
      "deepart",
      "digitalart",
      "distortionart",
      "fineart",
      "fineliner",
      "generativeart",
      "illustration",
      "instaart",
      "newmediaart",
      "proceduralart",
      "surrealism",
      "techspressionism",
      "thecreatart",
      "todaysartreport",
      "urbansketcher",
      "usk",
      "visualfodder"
    ],
    "ArtStation": [
      "abstract",
      "art",
      "artist",
      "artoftheday",
      "dart",
      "digitalart",
      "illustration",
      "painting"
    ],
    "Minds": [
      "artcommunity",
      "artfinder",
      "artwork",
      "creativecommunity",
      "painting"
    ],
    "Redbubble": [
      "abstract",
      "artist",
      "expressionist",
      "mjtdev"
    ]
  },
  "action": [
    {
      "callToAction": "View on Instagram",
      "url": "https://www.instagram.com/mjtdev"
    },
    {
      "callToAction": "View on Minds",
      "url": "https://www.minds.com/mjtdev"
    },
    {
      "callToAction": "View on ArtStation",
      "url": "https://mjtdev.artstation.com"
    },
    {
      "callToAction": "Buy on Redbubble",
      "url": "https://www.redbubble.com/people/truepurpose/shop"
    },
    {
      "callToAction": "Own the NFT",
      "url": "https://opensea.io/collection/mjt-dev"
    }
  ],
  "artId": "art-rsydix-kq5pom5c",
  "description": "\"Running on Empty\"\n\nDemand every last drop\n\n\nWe all start somewhere, and climb as high as we can, as quickly as possible.\n\nTo struggle is to live. \n\nThose who struggle the most, I think in some deep sense live the most.\n\n\nProcess details: \n\nI'm using custom software I'm developing to produce these images.\n\nTypescript, and HTML canvas are my present foundational tools, my virtual equivalents of traditional brushes, pigment and surface.\n\nI sample from reference images and 'extract' different things from them (colors, shapes, textures, etc...).\n\nI then refine and recombine the 'extracts' looking for something that speaks to me.\n\nOften I'm programming at the same time, tweaking and adding new processing capabilities to the software.\n\nThe end result is a large SVG built up of several layers.\n\nEach layer serves a specific visual purpose, much like how one would do a traditional painting (underpainting, tone, line, etc..).\n\nThe final SVG is usually around 50-150mb in size.\n \nThe balance between programming and art I find pleases my soul.\n\n\nHigh resolution image on my website\n\nhttps://mjt.dev/art-rsydix-kq5pom5c\n\nLinks to more of my work in my profile\n\nThanks :)\n\n---IG---\n#abstractart #abstractdigitalart #archdrawing #artforthesoul #artoftheday #artseeking #arttherapy #buildingsketch #citydrawing #contemporaryart #contemporaryexpressionism #creativegrammer #dailyarts #deepart #digitalart #distortionart #fineart #fineliner #generativeart #illustration #instaart #newmediaart #proceduralart #surrealism #techspressionism #thecreatart #todaysartreport #urbansketcher #usk #visualfodder\n\n---ArtStation---\n#abstract #art #artist #artoftheday #dart #digitalart #illustration #painting\n\n---Minds---\n#artcommunity #artfinder #artwork #creativecommunity #painting\n\n---Redbubble---\n#abstract #artist #expressionist #mjtdev\n\n"
}