{
  "backgroundColor": "rgb(105, 104, 100)",
  "textColor": "rgb(234, 234, 234)",
  "title": "Man about Town",
  "tagline": "There are things to be done",
  "property": {
    "artist": "Matthew Joseph Taylor",
    "mediatype": "image/png",
    "year": 2021,
    "style": [
      "Abstract",
      "Expressionist"
    ]
  },
  "hashTag": {
    "IG": [
      "abstractart",
      "abstractart_daily",
      "abstractdigital",
      "abstractdigitalart",
      "abstractexpressionism",
      "amazingabstracts",
      "artobserved",
      "artview",
      "codeart",
      "contemporaryexpressionism",
      "creativegrammer",
      "dailyabstract",
      "digitalpainters",
      "distortionart",
      "face",
      "figurativeabstract",
      "figurativeartist",
      "figurativeartists",
      "figurepainting",
      "generativeart",
      "head",
      "instaart",
      "modernabstract",
      "newaesthetic",
      "newmediaart",
      "techspressionism",
      "thecreatart",
      "theuniversalart",
      "unitedbyedit",
      "visualfodder"
    ],
    "ArtStation": [
      "abstract",
      "art",
      "artist",
      "artoftheday",
      "dart",
      "digitalart",
      "illustration",
      "painting"
    ],
    "Minds": [
      "art",
      "artcommunity",
      "artfinder",
      "artist",
      "digitalart"
    ],
    "Redbubble": [
      "abstract",
      "artist",
      "expressionist",
      "mjtdev"
    ]
  },
  "action": [
    {
      "callToAction": "View on Instagram",
      "url": "https://www.instagram.com/mjtdev"
    },
    {
      "callToAction": "View on Minds",
      "url": "https://www.minds.com/mjtdev"
    },
    {
      "callToAction": "View on ArtStation",
      "url": "https://mjtdev.artstation.com"
    },
    {
      "callToAction": "Buy on Redbubble",
      "url": "https://www.redbubble.com/people/truepurpose/shop"
    },
    {
      "callToAction": "Own the NFT",
      "url": "https://opensea.io/collection/mjt-dev"
    }
  ],
  "artId": "art-dl9xv8-kpsb4r29",
  "description": "\"Man about Town\"\n\nThere are things to be done\n\n\n\nHigh resolution image on my website\n\nhttps://mjt.dev/art-dl9xv8-kpsb4r29\n\nLinks to more of my work in my profile\n\nThanks :)\n\n---IG---\n#abstractart #abstractart_daily #abstractdigital #abstractdigitalart #abstractexpressionism #amazingabstracts #artobserved #artview #codeart #contemporaryexpressionism #creativegrammer #dailyabstract #digitalpainters #distortionart #face #figurativeabstract #figurativeartist #figurativeartists #figurepainting #generativeart #head #instaart #modernabstract #newaesthetic #newmediaart #techspressionism #thecreatart #theuniversalart #unitedbyedit #visualfodder\n\n---ArtStation---\n#abstract #art #artist #artoftheday #dart #digitalart #illustration #painting\n\n---Minds---\n#art #artcommunity #artfinder #artist #digitalart\n\n---Redbubble---\n#abstract #artist #expressionist #mjtdev\n\n"
}