{
  "backgroundColor": "rgb(234, 234, 234)",
  "textColor": "rgb(96, 96, 96)",
  "title": "Place to Place",
  "tagline": "Do we move, or does the world move?",
  "notes": "\nI note a sense of patient waiting with this one.\n\nThis is the 3rd tram/trolly that I've done recently. Feels like the beginnings of a potential series\n\nIt is nice to have a consistent subject as I do my daily practice.\n\nI'm not sure how I stumbled upon trams, but I'm finding it works well as a central motif.\n\nAs I've brought more detailed line-work in, I'm tending away from abstraction, which feels like a change.\n\nI know I want to follow consistent content, and assume others do as well.\n\nI'm toying with the idea of spinning off new IG accounts to allow more focus particular subjects.\n\nCurrently I'm thinking of accounts for the following:\n\n- 'pure' abstraction (no identifyable content)\n- 'impure' abstraction (abstract, but with some identifyable content)\n- technical experimentation (more comp science than art)\n- more realism focused on a consistent style+subject\n\nCurious if any of my followers have an opinion on this.\n\nProcess details: \n\nThis is a large SVG built up of several layers, much like how one would do a traditional painting.\n\nThe final SVGs are usually around 50-150mb in size.\n \nWith each piece I hone the software I'm crafting to produce the images.\n \nThe balance between programming and art I find pleases my soul.\n",
  "property": {
    "artist": "Matthew Joseph Taylor",
    "mediatype": "image/png",
    "year": 2021,
    "style": [
      "Abstract",
      "Expressionist"
    ]
  },
  "hashTag": {
    "IG": [
      "abstractdigital",
      "abstractdigitalart",
      "abstractexpressionism",
      "amazingabstracts",
      "architecturesketch",
      "artobserved",
      "artwillsaveus",
      "citydrawing",
      "codeart",
      "contemporaryexpressionism",
      "creativegrammer",
      "dailysketch",
      "digitalart",
      "digitalpainters",
      "distortionart",
      "figurepainting",
      "generativeart",
      "houseportrait",
      "housesketch",
      "illustration",
      "instaart",
      "modernabstract",
      "newaesthetic",
      "newmediaart",
      "nft",
      "thecreatart",
      "theuniversalart",
      "unitedbyedit",
      "urbansketcher",
      "usk"
    ],
    "ArtStation": [
      "abstract",
      "art",
      "artist",
      "artoftheday",
      "dart",
      "digitalart",
      "illustration",
      "painting"
    ],
    "Minds": [
      "art",
      "artistsonminds",
      "creativecommunity",
      "myart",
      "painting"
    ],
    "Redbubble": [
      "abstract",
      "artist",
      "expressionist",
      "mjtdev"
    ]
  },
  "action": [
    {
      "callToAction": "View on Instagram",
      "url": "https://www.instagram.com/mjtdev"
    },
    {
      "callToAction": "View on Minds",
      "url": "https://www.minds.com/mjtdev"
    },
    {
      "callToAction": "View on ArtStation",
      "url": "https://mjtdev.artstation.com"
    },
    {
      "callToAction": "Buy on Redbubble",
      "url": "https://www.redbubble.com/people/truepurpose/shop"
    },
    {
      "callToAction": "Own the NFT",
      "url": "https://opensea.io/collection/mjt-dev"
    }
  ],
  "artId": "art-qw3cpv-kpwt0d8g",
  "description": "\"Place to Place\"\n\nDo we move, or does the world move?\n\n\nI note a sense of patient waiting with this one.\n\nThis is the 3rd tram/trolly that I&#x27;ve done recently. Feels like the beginnings of a potential series\n\nIt is nice to have a consistent subject as I do my daily practice.\n\nI&#x27;m not sure how I stumbled upon trams, but I&#x27;m finding it works well as a central motif.\n\nAs I&#x27;ve brought more detailed line-work in, I&#x27;m tending away from abstraction, which feels like a change.\n\nI know I want to follow consistent content, and assume others do as well.\n\nI&#x27;m toying with the idea of spinning off new IG accounts to allow more focus particular subjects.\n\nCurrently I&#x27;m thinking of accounts for the following:\n\n- &#x27;pure&#x27; abstraction (no identifyable content)\n- &#x27;impure&#x27; abstraction (abstract, but with some identifyable content)\n- technical experimentation (more comp science than art)\n- more realism focused on a consistent style+subject\n\nCurious if any of my followers have an opinion on this.\n\nProcess details: \n\nThis is a large SVG built up of several layers, much like how one would do a traditional painting.\n\nThe final SVGs are usually around 50-150mb in size.\n \nWith each piece I hone the software I&#x27;m crafting to produce the images.\n \nThe balance between programming and art I find pleases my soul.\n\n\nHigh resolution image on my website\n\nhttps://mjt.dev/art-qw3cpv-kpwt0d8g\n\nLinks to more of my work in my profile\n\nThanks :)\n\n---IG---\n#abstractdigital #abstractdigitalart #abstractexpressionism #amazingabstracts #architecturesketch #artobserved #artwillsaveus #citydrawing #codeart #contemporaryexpressionism #creativegrammer #dailysketch #digitalart #digitalpainters #distortionart #figurepainting #generativeart #houseportrait #housesketch #illustration #instaart #modernabstract #newaesthetic #newmediaart #nft #thecreatart #theuniversalart #unitedbyedit #urbansketcher #usk\n\n---ArtStation---\n#abstract #art #artist #artoftheday #dart #digitalart #illustration #painting\n\n---Minds---\n#art #artistsonminds #creativecommunity #myart #painting\n\n---Redbubble---\n#abstract #artist #expressionist #mjtdev\n\n"
}