{
  "backgroundColor": "rgb(234, 234, 234)",
  "textColor": "rgb(96, 96, 96)",
  "title": "Mobile",
  "tagline": "The freedom of the well traveled path",
  "notes": "\nI like the 'erased' texture of this piece.\n\nIt sort of hums with energy.\n\nIs it coming into being, or going out of being?\n\nProcess details: \n\nI'm using custom software I'm developing to produce these images.\n\nTypescript, and HTML canvas are my present foundational tools, my virtual equivalents of traditional brushes, pigment and surface.\n\nI sample from reference images and 'extract' different things from them (colors, shapes, textures, etc...).\n\nI then refine and recombine the 'extracts' looking for something that speaks to me.\n\nOften I'm programming at the same time, tweaking and adding new processing capabilities to the software.\n\nThe end result is a large SVG built up of several layers.\n\nEach layer serves a specific visual purpose, much like how one would do a traditional painting (underpainting, tone, line, etc..).\n\nThe final SVG is usually around 50-150mb in size.\n \nThe balance between programming and art I find pleases my soul.\n",
  "property": {
    "artist": "Matthew Joseph Taylor",
    "mediatype": "image/png",
    "year": 2021,
    "style": [
      "Abstract",
      "Expressionist"
    ]
  },
  "hashTag": {
    "IG": [
      "abstractart",
      "abstractart_daily",
      "abstractdigital",
      "abstractexpressionism",
      "amazingabstracts",
      "architecturesketch",
      "art_seeking",
      "artobserved",
      "artoftheday",
      "cityscapeart",
      "contemporaryart",
      "creativegrammer",
      "dailyabstract",
      "dailyarts",
      "deepart",
      "digitalart",
      "digitalpainters",
      "distortionart",
      "figurepainting",
      "instaart",
      "modernabstract",
      "newaesthetic",
      "newmediaart",
      "sketchcollector",
      "thecreatart",
      "unitedbyedit",
      "urbansketch",
      "urbansketcher",
      "urbansketching",
      "viewartgallery"
    ],
    "ArtStation": [
      "abstract",
      "art",
      "artist",
      "artoftheday",
      "dart",
      "digitalart",
      "illustration",
      "painting"
    ],
    "Minds": [
      "art",
      "artcommunity",
      "artfinder",
      "artistsonminds",
      "myart"
    ],
    "Redbubble": [
      "abstract",
      "artist",
      "expressionist",
      "mjtdev"
    ]
  },
  "action": [
    {
      "callToAction": "View on Instagram",
      "url": "https://www.instagram.com/mjtdev"
    },
    {
      "callToAction": "View on Minds",
      "url": "https://www.minds.com/mjtdev"
    },
    {
      "callToAction": "View on ArtStation",
      "url": "https://mjtdev.artstation.com"
    },
    {
      "callToAction": "Buy on Redbubble",
      "url": "https://www.redbubble.com/people/truepurpose/shop"
    },
    {
      "callToAction": "Own the NFT",
      "url": "https://opensea.io/collection/mjt-dev"
    }
  ],
  "artId": "art-18e1332-kq89u36c",
  "description": "\"Mobile\"\n\nThe freedom of the well traveled path\n\n\nI like the 'erased' texture of this piece.\n\nIt sort of hums with energy.\n\nIs it coming into being, or going out of being?\n\nProcess details: \n\nI'm using custom software I'm developing to produce these images.\n\nTypescript, and HTML canvas are my present foundational tools, my virtual equivalents of traditional brushes, pigment and surface.\n\nI sample from reference images and 'extract' different things from them (colors, shapes, textures, etc...).\n\nI then refine and recombine the 'extracts' looking for something that speaks to me.\n\nOften I'm programming at the same time, tweaking and adding new processing capabilities to the software.\n\nThe end result is a large SVG built up of several layers.\n\nEach layer serves a specific visual purpose, much like how one would do a traditional painting (underpainting, tone, line, etc..).\n\nThe final SVG is usually around 50-150mb in size.\n \nThe balance between programming and art I find pleases my soul.\n\n\nHigh resolution image on my website\n\nhttps://mjt.dev/art-18e1332-kq89u36c\n\nLinks to more of my work in my profile\n\nThanks :)\n\n---IG---\n#abstractart #abstractart_daily #abstractdigital #abstractexpressionism #amazingabstracts #architecturesketch #art_seeking #artobserved #artoftheday #cityscapeart #contemporaryart #creativegrammer #dailyabstract #dailyarts #deepart #digitalart #digitalpainters #distortionart #figurepainting #instaart #modernabstract #newaesthetic #newmediaart #sketchcollector #thecreatart #unitedbyedit #urbansketch #urbansketcher #urbansketching #viewartgallery\n\n---ArtStation---\n#abstract #art #artist #artoftheday #dart #digitalart #illustration #painting\n\n---Minds---\n#art #artcommunity #artfinder #artistsonminds #myart\n\n---Redbubble---\n#abstract #artist #expressionist #mjtdev\n\n"
}