{
  "backgroundColor": "rgb(128, 128, 128)",
  "textColor": "rgb(21, 21, 21)",
  "title": "Follow at your own Peril",
  "tagline": "The things we chase rule us",
  "property": {
    "artist": "Matthew Joseph Taylor",
    "mediatype": "image/png",
    "year": 2021,
    "style": [
      "Abstract",
      "Expressionist"
    ]
  },
  "hashTag": {
    "IG": [
      "abstractart",
      "abstractdigital",
      "abstractdigitalart",
      "abstractexpressionism",
      "aliceinwonderland",
      "answers",
      "artview",
      "codeart",
      "contemporaryexpressionism",
      "dark",
      "darkart",
      "darkartwork",
      "darksurrealism",
      "deepart",
      "digitalart",
      "digitalpainters",
      "distortionart",
      "fineart",
      "follow",
      "newaesthetic",
      "newmediaart",
      "nft",
      "rabbit",
      "rabbitart",
      "techspressionism",
      "thecreatart",
      "theuniversalart",
      "unitedbyedit",
      "visualfodder",
      "whiterabbit"
    ],
    "ArtStation": [
      "abstract",
      "art",
      "artist",
      "artoftheday",
      "dart",
      "digitalart",
      "illustration",
      "painting"
    ],
    "Minds": [
      "artist",
      "artwork",
      "creativecommunity",
      "digitalart",
      "myart"
    ],
    "Redbubble": [
      "abstract",
      "artist",
      "expressionist",
      "mjtdev"
    ]
  },
  "action": [
    {
      "callToAction": "View on Instagram",
      "url": "https://www.instagram.com/mjtdev"
    },
    {
      "callToAction": "View on Minds",
      "url": "https://www.minds.com/mjtdev"
    },
    {
      "callToAction": "View on ArtStation",
      "url": "https://mjtdev.artstation.com"
    },
    {
      "callToAction": "Buy on Redbubble",
      "url": "https://www.redbubble.com/people/truepurpose/shop"
    },
    {
      "callToAction": "Own the NFT",
      "url": "https://opensea.io/collection/mjt-dev"
    }
  ],
  "artId": "art-1ckenol-konf4j2t",
  "description": "\"Follow at your own Peril\"\nThe things we chase rule us\n\nHigh resolution image, owning, etc...\n\nhttps://mjt.dev/art-1ckenol-konf4j2t\n\nLink in profile.\n\nThanks :)\n\n---IG---\n#abstractart #abstractdigital #abstractdigitalart #abstractexpressionism #aliceinwonderland #answers #artview #codeart #contemporaryexpressionism #dark #darkart #darkartwork #darksurrealism #deepart #digitalart #digitalpainters #distortionart #fineart #follow #newaesthetic #newmediaart #nft #rabbit #rabbitart #techspressionism #thecreatart #theuniversalart #unitedbyedit #visualfodder #whiterabbit\n\n---ArtStation---\n#abstract #art #artist #artoftheday #dart #digitalart #illustration #painting\n\n---Minds---\n#artist #artwork #creativecommunity #digitalart #myart\n\n---Redbubble---\n#abstract #artist #expressionist #mjtdev\n\n"
}