{
  "backgroundColor": "rgb(234, 234, 234)",
  "textColor": "rgb(96, 96, 96)",
  "title": "Funk It",
  "tagline": "Work hard, build it up, and then let it go",
  "notes": "\nI love old, broken, decaying, and abandoned things.\n\nThe things we discard often tell a rich story.\n\nAs things are used, life leaves its marks, and history is made.\n\nIt is fun to remember that we are the stuff of old broken stars.\n\nToday's old and broken is tomorrow's fresh and new.\n\nProcess details: \n\nI'm using custom software I'm developing to produce these images.\n\nTypescript, and HTML canvas are my present foundational tools, my virtual equivalents of traditional brushes, pigment and surface.\n\nI sample from reference images and 'extract' different things from them (colors, shapes, textures, etc...).\n\nI then refine and recombine the 'extracts' looking for something that speaks to me.\n\nOften I'm programming at the same time, tweaking and adding new processing capabilities to the software.\n\nThe end result is a large SVG built up of several layers.\n\nEach layer serves a specific visual purpose, much like how one would do a traditional painting (underpainting, tone, line, etc..).\n\nThe final SVG is usually around 50-150mb in size.\n \nThe balance between programming and art I find pleases my soul.\n",
  "property": {
    "artist": "Matthew Joseph Taylor",
    "mediatype": "image/png",
    "year": 2021,
    "style": [
      "Abstract",
      "Expressionist"
    ]
  },
  "hashTag": {
    "IG": [
      "abstractart_daily",
      "abstractdigital",
      "abstractdigitalart",
      "amazingabstracts",
      "archdrawing",
      "artobserved",
      "artoftheday",
      "artseeking",
      "artwillsaveus",
      "codeart",
      "dark",
      "darkart",
      "digitalpainters",
      "figurepainting",
      "fineart",
      "generativeart",
      "houseportrait",
      "housesketch",
      "illustration",
      "instaart",
      "modernabstract",
      "nft",
      "sketchcollector",
      "surrealism",
      "techspressionism",
      "todaysartreport",
      "urbansketch",
      "urbansketcher",
      "usk",
      "visualfodder"
    ],
    "ArtStation": [
      "abstract",
      "art",
      "artist",
      "artoftheday",
      "dart",
      "digitalart",
      "illustration",
      "painting"
    ],
    "Minds": [
      "artist",
      "artwork",
      "creativecommunity",
      "myart",
      "painting"
    ],
    "Redbubble": [
      "abstract",
      "artist",
      "expressionist",
      "mjtdev"
    ]
  },
  "action": [
    {
      "callToAction": "View on Instagram",
      "url": "https://www.instagram.com/mjtdev"
    },
    {
      "callToAction": "View on Minds",
      "url": "https://www.minds.com/mjtdev"
    },
    {
      "callToAction": "View on ArtStation",
      "url": "https://mjtdev.artstation.com"
    },
    {
      "callToAction": "Buy on Redbubble",
      "url": "https://www.redbubble.com/people/truepurpose/shop"
    },
    {
      "callToAction": "Own the NFT",
      "url": "https://opensea.io/collection/mjt-dev"
    }
  ],
  "artId": "art-1h3ha4q-kq2p6cq6",
  "description": "\"Funk It\"\n\nWork hard, build it up, and then let it go\n\n\nI love old, broken, decaying, and abandoned things.\n\nThe things we discard often tell a rich story.\n\nAs things are used, life leaves its marks, and history is made.\n\nIt is fun to remember that we are the stuff of old broken stars.\n\nToday's old and broken is tomorrow's fresh and new.\n\nProcess details: \n\nI'm using custom software I'm developing to produce these images.\n\nTypescript, and HTML canvas are my present foundational tools, my virtual equivalents of traditional brushes, pigment and surface.\n\nI sample from reference images and 'extract' different things from them (colors, shapes, textures, etc...).\n\nI then refine and recombine the 'extracts' looking for something that speaks to me.\n\nOften I'm programming at the same time, tweaking and adding new processing capabilities to the software.\n\nThe end result is a large SVG built up of several layers.\n\nEach layer serves a specific visual purpose, much like how one would do a traditional painting (underpainting, tone, line, etc..).\n\nThe final SVG is usually around 50-150mb in size.\n \nThe balance between programming and art I find pleases my soul.\n\n\nHigh resolution image on my website\n\nhttps://mjt.dev/art-1h3ha4q-kq2p6cq6\n\nLinks to more of my work in my profile\n\nThanks :)\n\n---IG---\n#abstractart_daily #abstractdigital #abstractdigitalart #amazingabstracts #archdrawing #artobserved #artoftheday #artseeking #artwillsaveus #codeart #dark #darkart #digitalpainters #figurepainting #fineart #generativeart #houseportrait #housesketch #illustration #instaart #modernabstract #nft #sketchcollector #surrealism #techspressionism #todaysartreport #urbansketch #urbansketcher #usk #visualfodder\n\n---ArtStation---\n#abstract #art #artist #artoftheday #dart #digitalart #illustration #painting\n\n---Minds---\n#artist #artwork #creativecommunity #myart #painting\n\n---Redbubble---\n#abstract #artist #expressionist #mjtdev\n\n"
}