{
  "backgroundColor": "rgb(35, 35, 35)",
  "textColor": "rgb(139, 139, 139)",
  "title": "Daeva",
  "tagline": "Careful what you wish for",
  "property": {
    "artist": "Matthew Joseph Taylor",
    "mediatype": "image/png",
    "year": 2021,
    "style": [
      "Abstract",
      "Expressionist"
    ]
  },
  "hashTag": {
    "IG": [
      "abstractdigitalart",
      "artobserved",
      "artoftheday",
      "arttherapy",
      "artview",
      "artwillsaveus",
      "contemporaryart",
      "contemporaryexpressionism",
      "creativegrammer",
      "dailyabstract",
      "darkart",
      "darkartwork",
      "digitalpainters",
      "distortionart",
      "face",
      "figurativeabstract",
      "figurativeartist",
      "figurativeartists",
      "fineart",
      "generativeart",
      "head",
      "instaart",
      "mastersofdarkart",
      "modernabstract",
      "newaesthetic",
      "newmediaart",
      "techspressionism",
      "theuniversalart",
      "unitedbyedit",
      "visualfodder"
    ],
    "ArtStation": [
      "abstract",
      "art",
      "artist",
      "artoftheday",
      "dart",
      "digitalart",
      "illustration",
      "painting"
    ],
    "Minds": [
      "art",
      "artcommunity",
      "artist",
      "creativecommunity",
      "digitalart"
    ],
    "Redbubble": [
      "abstract",
      "artist",
      "expressionist",
      "mjtdev"
    ]
  },
  "action": [
    {
      "callToAction": "View on Instagram",
      "url": "https://www.instagram.com/mjtdev"
    },
    {
      "callToAction": "View on Minds",
      "url": "https://www.minds.com/mjtdev"
    },
    {
      "callToAction": "View on ArtStation",
      "url": "https://mjtdev.artstation.com"
    },
    {
      "callToAction": "Buy on Redbubble",
      "url": "https://www.redbubble.com/people/truepurpose/shop"
    },
    {
      "callToAction": "Own the NFT",
      "url": "https://opensea.io/collection/mjt-dev"
    }
  ],
  "artId": "art-1i67yni-kpr6eq4s",
  "description": "\"Daeva\"\n\nCareful what you wish for\n\n\n\nHigh resolution image on my website\n\nhttps://mjt.dev/art-1i67yni-kpr6eq4s\n\nLinks to more of my work in my profile\n\nThanks :)\n\n---IG---\n#abstractdigitalart #artobserved #artoftheday #arttherapy #artview #artwillsaveus #contemporaryart #contemporaryexpressionism #creativegrammer #dailyabstract #darkart #darkartwork #digitalpainters #distortionart #face #figurativeabstract #figurativeartist #figurativeartists #fineart #generativeart #head #instaart #mastersofdarkart #modernabstract #newaesthetic #newmediaart #techspressionism #theuniversalart #unitedbyedit #visualfodder\n\n---ArtStation---\n#abstract #art #artist #artoftheday #dart #digitalart #illustration #painting\n\n---Minds---\n#art #artcommunity #artist #creativecommunity #digitalart\n\n---Redbubble---\n#abstract #artist #expressionist #mjtdev\n\n"
}