{
  "backgroundColor": "rgb(128, 128, 128)",
  "textColor": "rgb(21, 21, 21)",
  "title": "Endless Searching",
  "tagline": "No rest...",
  "property": {
    "artist": "Matthew Joseph Taylor",
    "mediatype": "image/png",
    "year": 2021,
    "style": [
      "Abstract",
      "Expressionist"
    ]
  },
  "hashTag": {
    "IG": [
      "abstractart",
      "abstractart_daily",
      "abstractdigital",
      "abstractdigitalart",
      "abstractexpressionism",
      "amazingabstracts",
      "artoftheday",
      "arttherapy",
      "artview",
      "artwillsaveus",
      "contemporaryart",
      "contemporaryexpressionism",
      "creativegrammer",
      "dark",
      "darksurrealism",
      "digitalpainters",
      "face",
      "figurativeabstract",
      "figurativeartist",
      "figurativeartists",
      "fineart",
      "generativeart",
      "head",
      "instaart",
      "mastersofdarkart",
      "newaesthetic",
      "newmediaart",
      "thecreatart",
      "theuniversalart",
      "unitedbyedit"
    ],
    "ArtStation": [
      "abstract",
      "art",
      "artist",
      "artoftheday",
      "dart",
      "digitalart",
      "illustration",
      "painting"
    ],
    "Minds": [
      "art",
      "artist",
      "artistsonminds",
      "artwork",
      "digitalart"
    ],
    "Redbubble": [
      "abstract",
      "artist",
      "expressionist",
      "mjtdev"
    ]
  },
  "action": [
    {
      "callToAction": "View on Instagram",
      "url": "https://www.instagram.com/mjtdev"
    },
    {
      "callToAction": "View on Minds",
      "url": "https://www.minds.com/mjtdev"
    },
    {
      "callToAction": "View on ArtStation",
      "url": "https://mjtdev.artstation.com"
    },
    {
      "callToAction": "Buy on Redbubble",
      "url": "https://www.redbubble.com/people/truepurpose/shop"
    },
    {
      "callToAction": "Own the NFT",
      "url": "https://opensea.io/collection/mjt-dev"
    }
  ],
  "artId": "art-1pgcoo9-kpmpdaaa",
  "description": "\"Endless Searching\"\n\nNo rest...\n\n\n\nHigh resolution image on my website\n\nhttps://mjt.dev/art-1pgcoo9-kpmpdaaa\n\nLinks to more of my work in my profile\n\nThanks :)\n\n---IG---\n#abstractart #abstractart_daily #abstractdigital #abstractdigitalart #abstractexpressionism #amazingabstracts #artoftheday #arttherapy #artview #artwillsaveus #contemporaryart #contemporaryexpressionism #creativegrammer #dark #darksurrealism #digitalpainters #face #figurativeabstract #figurativeartist #figurativeartists #fineart #generativeart #head #instaart #mastersofdarkart #newaesthetic #newmediaart #thecreatart #theuniversalart #unitedbyedit\n\n---ArtStation---\n#abstract #art #artist #artoftheday #dart #digitalart #illustration #painting\n\n---Minds---\n#art #artist #artistsonminds #artwork #digitalart\n\n---Redbubble---\n#abstract #artist #expressionist #mjtdev\n\n"
}