{
  "backgroundColor": "rgb(128, 128, 128)",
  "textColor": "rgb(21, 21, 21)",
  "title": "Solitude",
  "tagline": "The beauty of peace and quiet",
  "property": {
    "artist": "Matthew Joseph Taylor",
    "mediatype": "image/png",
    "year": 2021,
    "style": [
      "Abstract",
      "Expressionist"
    ]
  },
  "hashTag": {
    "IG": [
      "abstractart",
      "abstractart_daily",
      "abstractdigital",
      "abstractdigitalart",
      "abstractexpressionism",
      "artobserved",
      "artoftheday",
      "arttherapy",
      "artview",
      "artwillsaveus",
      "codeart",
      "contemporaryexpressionism",
      "creativegrammer",
      "dark",
      "darkart",
      "darkartwork",
      "deepart",
      "digitalpainters",
      "distortionart",
      "fineart",
      "generativeart",
      "instaart",
      "modernabstract",
      "newaesthetic",
      "newmediaart",
      "nft",
      "techspressionism",
      "thecreatart",
      "theuniversalart",
      "visualfodder"
    ],
    "ArtStation": [
      "abstract",
      "art",
      "artist",
      "artoftheday",
      "dart",
      "digitalart",
      "illustration",
      "painting"
    ],
    "Minds": [
      "art",
      "artcommunity",
      "artist",
      "artistsonminds",
      "painting"
    ],
    "Redbubble": [
      "abstract",
      "artist",
      "expressionist",
      "mjtdev"
    ]
  },
  "action": [
    {
      "callToAction": "View on Instagram",
      "url": "https://www.instagram.com/mjtdev"
    },
    {
      "callToAction": "View on Minds",
      "url": "https://www.minds.com/mjtdev"
    },
    {
      "callToAction": "View on ArtStation",
      "url": "https://mjtdev.artstation.com"
    },
    {
      "callToAction": "Buy on Redbubble",
      "url": "https://www.redbubble.com/people/truepurpose/shop"
    },
    {
      "callToAction": "Own the NFT",
      "url": "https://opensea.io/collection/mjt-dev"
    }
  ],
  "artId": "art-d7bta4-kpfwlbbj",
  "description": "\"Solitude\"\n\nThe beauty of peace and quiet\n\n\n\nHigh resolution image on my website\n\nhttps://mjt.dev/art-d7bta4-kpfwlbbj\n\nLinks to more of my work in my profile\n\nThanks :)\n\n---IG---\n#abstractart #abstractart_daily #abstractdigital #abstractdigitalart #abstractexpressionism #artobserved #artoftheday #arttherapy #artview #artwillsaveus #codeart #contemporaryexpressionism #creativegrammer #dark #darkart #darkartwork #deepart #digitalpainters #distortionart #fineart #generativeart #instaart #modernabstract #newaesthetic #newmediaart #nft #techspressionism #thecreatart #theuniversalart #visualfodder\n\n---ArtStation---\n#abstract #art #artist #artoftheday #dart #digitalart #illustration #painting\n\n---Minds---\n#art #artcommunity #artist #artistsonminds #painting\n\n---Redbubble---\n#abstract #artist #expressionist #mjtdev\n\n"
}