{
  "backgroundColor": "rgb(128, 128, 128)",
  "textColor": "rgb(21, 21, 21)",
  "title": "Stand Tall",
  "tagline": "Is it time to face reality?",
  "property": {
    "artist": "Matthew Joseph Taylor",
    "mediatype": "image/png",
    "year": 2021,
    "style": [
      "Abstract",
      "Expressionist"
    ]
  },
  "hashTag": {
    "IG": [
      "abstractart",
      "abstractdigital",
      "abstractdigitalart",
      "abstractexpressionism",
      "artobserved",
      "artoftheday",
      "artview",
      "codeart",
      "contemporaryart",
      "contemporaryexpressionism",
      "deepart",
      "digitalart",
      "digitalpainters",
      "distortionart",
      "fineart",
      "newaesthetic",
      "newmediaart",
      "nft",
      "ostrich",
      "ostrichart",
      "spiritanimal",
      "techspressionism",
      "thecreatart",
      "theuniversalart",
      "unitedbyedit",
      "visualfodder",
      "wildlife",
      "wildlifeart"
    ],
    "ArtStation": [
      "abstract",
      "art",
      "artist",
      "artoftheday",
      "dart",
      "digitalart",
      "illustration",
      "painting"
    ],
    "Minds": [
      "artcommunity",
      "artfinderapril",
      "artist",
      "artwork",
      "painting"
    ],
    "Redbubble": [
      "abstract",
      "artist",
      "expressionist",
      "mjtdev"
    ]
  },
  "action": [
    {
      "callToAction": "View on Instagram",
      "url": "https://www.instagram.com/mjtdev"
    },
    {
      "callToAction": "View on Minds",
      "url": "https://www.minds.com/mjtdev"
    },
    {
      "callToAction": "View on ArtStation",
      "url": "https://mjtdev.artstation.com"
    },
    {
      "callToAction": "Buy on Redbubble",
      "url": "https://www.redbubble.com/people/truepurpose/shop"
    },
    {
      "callToAction": "Own the NFT",
      "url": "https://opensea.io/collection/mjt-dev"
    }
  ],
  "artId": "art-m62zsc-koj90gi8",
  "description": "\"Stand Tall\"\nIs it time to face reality?\n\nHigh resolution image, owning, etc...\n\nhttps://mjt.dev/art-m62zsc-koj90gi8\n\nLink in profile.\n\nThanks :)\n\n---IG---\n#abstractart #abstractdigital #abstractdigitalart #abstractexpressionism #artobserved #artoftheday #artview #codeart #contemporaryart #contemporaryexpressionism #deepart #digitalart #digitalpainters #distortionart #fineart #newaesthetic #newmediaart #nft #ostrich #ostrichart #spiritanimal #techspressionism #thecreatart #theuniversalart #unitedbyedit #visualfodder #wildlife #wildlifeart\n\n---ArtStation---\n#abstract #art #artist #artoftheday #dart #digitalart #illustration #painting\n\n---Minds---\n#artcommunity #artfinderapril #artist #artwork #painting\n\n---Redbubble---\n#abstract #artist #expressionist #mjtdev\n\n"
}