{
  "backgroundColor": "rgb(234, 234, 234)",
  "textColor": "rgb(96, 96, 96)",
  "title": "Tomorrow's Yesterday",
  "tagline": "Today is such a lovely time",
  "notes": "\n\nExperimenting with combining.\n\nIMHO artistic creativity is combination with filtering.\n\nBy giving myself the freedom to combine references images, I feel like I've unlocked a tool that allows greater expression.\n\nI don't think this is unique idea/feeling.\n\nIt is nice to have experienced the joy of combinating.\n\nProcess details: \n\nI'm using custom software I'm developing to produce these images.\n\nTypescript, and HTML canvas are my present foundational tools, my virtual equivalents of traditional brushes, pigment and surface.\n\nI sample from reference images and 'extract' different things from them (colors, shapes, textures, etc...).\n\nI then refine and recombine the 'extracts' looking for something that speaks to me.\n\nOften I'm programming at the same time, tweaking and adding new processing capabilities to the software.\n\nThe end result is a large SVG built up of several layers.\n\nEach layer serves a specific visual purpose, much like how one would do a traditional painting (underpainting, tone, line, etc..).\n\nThe final SVG is usually around 50-150mb in size.\n \nThe balance between programming and art I find pleases my soul.\n",
  "property": {
    "artist": "Matthew Joseph Taylor",
    "mediatype": "image/png",
    "year": 2021,
    "style": [
      "Abstract",
      "Expressionist"
    ]
  },
  "hashTag": {
    "IG": [
      "abstractart",
      "abstractdigital",
      "abstractdigitalart",
      "abstractexpressionism",
      "architecturesketch",
      "artobserved",
      "arttherapy",
      "artview",
      "citydrawing",
      "codeart",
      "contemporaryart",
      "contemporaryexpressionism",
      "creativegrammer",
      "dailysketch",
      "deepart",
      "digitalpainters",
      "fineart",
      "generativeart",
      "houseportrait",
      "housesketch",
      "illustration",
      "newaesthetic",
      "newmediaart",
      "nft",
      "sketchcollector",
      "techspressionism",
      "thecreatart",
      "theuniversalart",
      "urbansketcher",
      "urbansketching"
    ],
    "ArtStation": [
      "abstract",
      "art",
      "artist",
      "artoftheday",
      "dart",
      "digitalart",
      "illustration",
      "painting"
    ],
    "Minds": [
      "artistsonminds",
      "artwork",
      "creativecommunity",
      "digitalart",
      "myart"
    ],
    "Redbubble": [
      "abstract",
      "artist",
      "expressionist",
      "mjtdev"
    ]
  },
  "action": [
    {
      "callToAction": "View on Instagram",
      "url": "https://www.instagram.com/mjtdev"
    },
    {
      "callToAction": "View on Minds",
      "url": "https://www.minds.com/mjtdev"
    },
    {
      "callToAction": "View on ArtStation",
      "url": "https://mjtdev.artstation.com"
    },
    {
      "callToAction": "Buy on Redbubble",
      "url": "https://www.redbubble.com/people/truepurpose/shop"
    },
    {
      "callToAction": "Own the NFT",
      "url": "https://opensea.io/collection/mjt-dev"
    }
  ],
  "artId": "art-kb87bb-kpxlt8su",
  "description": "\"Tomorrow's Yesterday\"\n\nToday is such a lovely time\n\n\n\nExperimenting with combining.\n\nIMHO artistic creativity is combination with filtering.\n\nBy giving myself the freedom to combine references images, I feel like I've unlocked a tool that allows greater expression.\n\nI don't think this is unique idea/feeling.\n\nIt is nice to have experienced the joy of combinating.\n\nProcess details: \n\nI'm using custom software I'm developing to produce these images.\n\nTypescript, and HTML canvas are my present foundational tools, my virtual equivalents of traditional brushes, pigment and surface.\n\nI sample from reference images and 'extract' different things from them (colors, shapes, textures, etc...).\n\nI then refine and recombine the 'extracts' looking for something that speaks to me.\n\nOften I'm programming at the same time, tweaking and adding new processing capabilities to the software.\n\nThe end result is a large SVG built up of several layers.\n\nEach layer serves a specific visual purpose, much like how one would do a traditional painting (underpainting, tone, line, etc..).\n\nThe final SVG is usually around 50-150mb in size.\n \nThe balance between programming and art I find pleases my soul.\n\n\nHigh resolution image on my website\n\nhttps://mjt.dev/art-kb87bb-kpxlt8su\n\nLinks to more of my work in my profile\n\nThanks :)\n\n---IG---\n#abstractart #abstractdigital #abstractdigitalart #abstractexpressionism #architecturesketch #artobserved #arttherapy #artview #citydrawing #codeart #contemporaryart #contemporaryexpressionism #creativegrammer #dailysketch #deepart #digitalpainters #fineart #generativeart #houseportrait #housesketch #illustration #newaesthetic #newmediaart #nft #sketchcollector #techspressionism #thecreatart #theuniversalart #urbansketcher #urbansketching\n\n---ArtStation---\n#abstract #art #artist #artoftheday #dart #digitalart #illustration #painting\n\n---Minds---\n#artistsonminds #artwork #creativecommunity #digitalart #myart\n\n---Redbubble---\n#abstract #artist #expressionist #mjtdev\n\n"
}